,Display Sentences,Display Polarity
4009,"half the screen on the laptop went dead within a couple of weeks. | the laptop set on a desk, we did not travel with it, drop it, move it around or anything that would have damaged the screen. | the screen did not appear to be physically damaged so we contacted acer who said to send it in for an evaluation and repair. | they wanted $250 to replace the screen for a $350 laptop.",Negative
4010,she loves the lightweight and large screen.,Positive
4011,the screen quality is not what it says. | it is just a typical lcd screen that has a little more brightness than it is older predecessor.,Positive
4012,"amazing cpu, ram, ssd, and ips screen meaning best value for your typical laptop usage.",Positive
4013,beautiful screen.,Positive
4014,i like the touchscreen and the flippy part to turn it into a tablet but this things keyboard blows.,Neutral
4015,"for the price point, this is a basic laptop that is not touch screen. | i am not sure why this laptop appears as part of a search for touch screen, and why it is listed as an option to be rated.",Negative
4016,the screen display is not 1920 times 1080. go on the system information and you will find the resolution much lower than that and its obvious comparing it to my other laptops,Positive
4017,it is beautiful light weight with crystal clear resolution.,Positive
4018,"speakers sound good, clear display,you can replace 2242 nvme ssd yourself if 64gb emmc not enough which did little help some system response time but not a big difference.bought at$429 and now price drop to $399 right now…..",Positive
4019,"whenever i played horror games, the edges of the screen were too bright.",Positive
4020,the screen is fantastic. | initially the screen occasionally blinks when viewing video in chrome.,Positive
4021,"not a touch screen, was disappointed with that.",Negative
4022,"this acer laptop pc has a good display, the backlit keyboard is a real plus and the machine delivers decent performance.",Positive
4023,screen locks and you have to wait 5 minutes for it to try again.,Neutral
4024,i do not have any issue with the screen display and no issue connecting to microsoft account and store. | i just have to set up some things before the first use.the keyboard could have a backlit display for use at night time tho! | the screen is bigger than i thought in a good way tho!,Positive
4025,i havent used the laptop much and it is not a touch screen so i am unsure why that was an option for rating.,Positive
4026,size of screen is good for young students.,Positive
4027,"love the display, hdmi out, backlit kybd, mini number pad & yes, even the touchpad. | windows provides screen notifications for wifi radio status & audio mute. | i must be missing something because the only way i see is to catch the edge of the aluminum top (screen) cover, which just barely protrudes past the base.",Positive
4028,the touch screen can be a little slow at times but it was not be a deal breaker.,Negative
4029,after 8 months the screen went black. | there was not a scratch on the screen.,Negative
4030,"got this laptop to replace a 14"" one i was using for work to get a bigger screen but 1st time i had it outdoors with the brightness all the way up i could not see a thing.",Neutral
4031,"i had to get used to not having a sd drive slot and no touch screen, but other than that it gets the job done.",Negative
4032,"the screen on this product broke two months after i bought it, without ever being dropped or damaged.",Neutral
4033,the screen quality is amazing!,Positive
4034,there is no power up on the screen or the keyboard.,Neutral
4035,"the screen quality is excellent and the i/o has everything that we need to connect the camera, monitor and printer.",Positive
4036,terrible screen.,Negative
4037,"screen is great, keyboard has a nice feel to it, and performed well while playing games without any issues.",Positive
4038,i turn it on but the screen is completely black.,Negative
4039,this computer is ok but the screen came with a white dot light on the screen. | this is the 3rd laptop i get from amazon with something wrong with the screen.,Positive
4040,i cannot believe how crappy the screen quality is.,Neutral
4041,"the wifi connection is strong, the screen is a nice size.",Positive
4042,"unboxed and booted up and as soon as the blue screen turned on, i noticed a few small white vertical lines (dead pixels? | )n the left side of screen.",Negative
4043,it sucks first day of receiving the screen blacked out on me i would have to battery restart it every time i wanted to use it,Negative
4044,bought it for my 84 year old mom it is very user friendly she has no pc skills loves the touch screen,Positive
4045,"brand new 2020, no touch screen but impeccable quality for a smaller laptop and unbeatable price!",Positive
4046,"very light, great screen, ssd drive and another spot for additional, up-gradable memory, i increased to 12 gig, plenty fast..i needed a windows machine due to microsoft ending support for windows 7 which i love.",Positive
4047,the screen is awesome the memory hard drive is not enough for gaming,Positive
4048,i had concerns about the screen brightness because of some reviews but i think the screen is plenty bright.,Positive
4049,"this does not have touch screen on my model. | the fhd display really surprised me. | no way to fix that without replacing the screen. | it forces you to keep the screen open, which is not good to have static screens. | i have a warranty but again, it is not going to cover this damage, so i spent money and not even 30 days later it has depreciated in value by the price of the lcd screen.",Positive
4050,it was a perfect size the thickness and the screen quality was nice a clear.,Positive
4051,now the screen completely went blank.,Positive
4052,i love the size of the screen!,Positive
4053,the display and sound is very nice.,Positive
4054,i cannot do anything on this the response time is terrible and the screen quality is really low,Negative
4055,it had a vertical line across the screen.,Neutral
4056,the touchscreen is a beautiful touch for this price range.,Positive
4057,he loves the new computer the touch screen works great and computer is super light and convenient. | do not bother buying touchscreen pen that goes with it.,Positive
4058,the viewing screen partially detached from the keyword.,Negative
4059,great price for touch screen tablet and laptop chrome book versatility.,Positive
4060,"this particular version of the legion 5 15 is equipped with an amd ryzen 7 5800h, nvidia 3050 ti 4gb, 1080p 165hz screen, 16 gb of ram, and a 512gb nvme ssd.",Positive
4061,touchscreen works well.,Neutral
4062,"full hd ips screen, backlit keyboard, aluminum cover.",Positive
4063,"at approximately six weeks into use, the screen went totally blank while the motherboard still lit up. | the folks at the geek squad were able to boot up the computer to an external screen, indicating the screen on the laptop was defective.",Positive
4064,the resolution is great and the performance is fast for every day use and light streaming.,Positive
4065,the laptop was purchased in july and now in november when i went to close the laptop screen slowly mind you the right bottom corner of the screen pulled away from the frame.,Negative
4066,screen quality touch is xlent.,Neutral
4067,the computer has not been used that often and now it is just a black screen. | the screen quality was also very poor on this computer.,Negative
4068,the screen size is more than adequate and the definition is crisp.,Positive
4069,"screen- i have an ipad pro for movies etc, but the screen on this is very good, speed-we have high speed fiber so apart from waiting a second or to longer speed is ok, never stalled or fluttered, battery life is good, light weight, but the price is probably the best benefit",Positive
4070,the display is great under normal\typical conditions. | well the screen display was good but it was a little too small at 11.6 inches.,Positive
4071,the touchscreen is not the best at response time.,Positive
4072,"slim and lightweight with a good screen size and resolution, good processing power, and the ability to run most games at least decently.",Positive
4073,just note that it is not touchscreen.,Neutral
4074,the screen display is top notch and with it being windows baded it is compatible with all my other devices as well.,Positive
4075,this laptop is such poor quality that the monitor screen separated from its backing and also one of the hingers appears to be coming lose.,Negative
4076,the touch screen is missing touches sometimes.,Negative
4077,"screen is large with good quality picture, sound is a bit weak but good enough considering it is a slim case laptop for such a great price point.",Positive
4078,the touch screen is a great feature.,Positive
4079,"(ignore the bubbles in my screen protector, i know theyre bad) lol",Positive
4080,"i wish it had a touch screen, but that was not a deal-breaker.",Neutral
4081,battery life is great and so is the display.,Positive
4082,"the screen being ips (wider viewing angle, trust me, you want this) is another perk you may not find for such a low price.",Neutral
4083,screen is fantastic. | this laptop does not have a touch screen and is not for gaming.,Positive
4084,the screen just goes dark and the computer is impossible to use at that point so you just have to force restart it and hope for the best.,Positive
4085,"the touch screen works fine, and i have not had any major problems with the laptop other than i think it may have been used before?",Positive
4086,this has no touch screen.,Neutral
4087,red looks orange on my screen. | i have tried to capture what i see on my samsung desktop screen (pic 1) and what i see on my acer aspire 5 slim laptop screen (pic 2) of the very same web page and red color hex #ff0000.,Neutral
4088,nice screen and much faster than my old laptop.,Positive
4089,"the hinge eventually pulled away from the screen, and the track pad was sticky and it lasted less than a year.",Negative
4090,"this laptop looks nice, is fast and has a nice screen resolution for the price.",Positive
4091,screen has great refresh rate.,Positive
4092,"there are a few times where the screen will come up as pixels, so i will need to get that checked out, but that is the only issue i have had.",Negative
4093,"several months ago, however, the device ignored my instructions not update windows 10, auto-updated in the middle of the night, and has been unable to make it past the startup screen ever since.",Negative
4094,"good screen, great keyboard and pad and it is surprisingly fast.",Positive
4095,what this is: a super lightweight laptop with a descent set of ports and a workable screen at a fantastic price with the latest windows version.,Positive
4096,fantastic screen & color.,Positive
4097,the screen and battery life is good.,Positive
4098,"love the lightweight, clean design, and great screen.",Positive
4099,i bought this in january 14 2021 the screen is wiggle lines all over and can not see screen i think it should have lasted longer then this very disappointed i will never by this brand again i have hp that has lasted for 5and 6 years,Negative
4100,"take everything from the m1 macbook air, make it lighter, slimmer, with a better camera, more screen real estate along with a magsafe charger & incredibly faster m2 chip, all in a less volume package than it is predecessor.",Positive
4101,i am amazed with the performance screen quality.,Neutral
4102,"the chassis is so flexible that i cannot adjust the screen angle without moving the power connector on the motherboard, which causes the machine to shut down.",Negative
4103,i was very pleased with the screen quality.,Positive
4104,"the display also seems to be standard with other chromebooks, but compared to my others (dell,asus) the colors display very well.",Positive
4105,"when i first started up this computer, it began updates of the software, then it would not run anything... the evil blue screen of death took over.",Negative
4106,the screen is a nice size.,Positive
4107,the fhd display of this laptop is absolutely good.,Positive
4108,"i love the screen quality, i have not really used it for gaming at all, mostly for note taking and enjoying a tv show here and there.",Positive
4109,"screen is very clear, bezels are a little too big however it lasts for near 14 hours of class without needing a charge which is impressive.",Positive
4110,i have had it for a year and i just now decided to review this.the screen quality is great so if your into just watching movies and such this is great.sadly the touchscreen did not work for me.,Positive
4111,"screen quality could be a bit better, but it is mostly a work computer.",Positive
4112,it is nice to have a keyboard and a touchscreen feature.,Positive
4113,"i was looking for something under 400 for years but never made a purchase because i have my own requirements: good speed, full hd (1080p), ips screen, backlit keyboard, and light weight.",Positive
4114,"the size of the screen is appropriate for me, i use it as a personal laptop at home.",Positive
4115,good looking screen too!,Positive
4116,the screen is crisp and clear and the finish is sleek and light.,Positive
4117,"green boxes appear all over the screen, i am unable to open games, and cad modeling program!",Negative
4118,my screen cracked just by closing. | search google for cracked screens in m1/m2.,Neutral
4119,"screen is very bright, speakers are excellent, and keyboard feels great!!!",Positive
4120,i was not happy with the display quality so i returned it.,Negative
4121,"chromebooks answer the question, ""what if i had a cheap device that cannot do quite as much as my phone, with a keyboard and a larger, but not nearly as clear, screen?""",Positive
4122,"i settled on the pulse gl66 for the following reasons: processor, screen, performance, quality of construction, expansion, weight.",Neutral
4123,"solid hardware that looks good too, and a quality screen on top of that.",Positive
4124,"i like the slim design and screen size and it comes with windows 10, which i prefer over windows 11. i would highly recommend this laptop to anybody looking for an inexpensive laptop, its a big bang for your buck.",Positive
4125,i need to add a little extra ram but the overall quality for the price is very surprising it can handle just about anything but the screen itself is a little dim and that is the only drawback and i very cheaply priced overachieving gaming machine,Positive
4126,he didnt even know there was a touch screen.,Neutral
4127,display and quality screen.,Neutral
4128,"it has touch screen, amazing battery life, and light weight-perfect for travel. | i love the clear and bright display.",Positive
4129,"i absolutely love my new laptop it is 20x better than my other laptop because the battery life lasts longer and i can multitask multiple assignments all at the same time; also, it is a very reliable and the resolution and speed is amazing",Positive
4130,"i am not a gamer so i do not know if it is okay, touchscreen and everything i need is more than enough, no complaints.",Positive
4131,"other than that great budget laptop for surfing the web or just watching netflix, nice screen and performance.",Positive
4132,"it has a full hd 1080p display, high quality metal screen and is very light weight for the size. | once you configure the laptop, even after shut down, it will take less then 10 seconds to boot to the login screen.",Positive
4133,screen quality is amazing battery lasts forever and camera quality is great!,Positive
4134,"however, my screen has pretty nasty bleedthrough, and it came with a laptop that only holds two hours charge while only using google docs.",Negative
4135,the screen quality is very clear.,Positive
4136,"i bought this convertible laptop/tablet primarily for displaying music on a stand. | i wanted the widest screen possible when the screen is vertical (higher than wide). | the touch screen is great, although i would like to be able to adjust the sensitivity.",Positive
4137,"the screen quality is amazing. | we did not get a touch screen and while we are gamers, we have not used it for such.",Positive
4138,the keys are nicely spaced apart even if it is just a 14 inches screen sized computer.,Positive
4139,pleasantly surprised by the display quality. | resolution is decent and i really like the 1366 x 912 dimension -- i prefer it to 1366 x 768. processor is zippy.,Positive
4140,tried to set up using the onscreen instructions and the computer locked up midway.,Neutral
4141,it is not a gaming or touch screen just a standard laptop.,Neutral
4142,he says it is the perfect size; loves the quality of the screen/pictures; the ability to flip and fold like a tablet; and thinks the back lit keyboard is cool.,Positive
4143,she loves the lightweight and large screen.,Positive
4144,"update om this laptop i bought it in may 19 2020 the keys are sticking an now the touch pads has stopped working the screen flickers ,this has turned out to be worthless ,these are not cheap ,so save your money",Negative
4145,"got this laptop to replace a 14"" one i was using for work to get a bigger screen but 1st time i had it outdoors with the brightness all the way up i could not see a thing.",Neutral
4146,it turned to an all black screen within a few weeks of use.,Negative
4147,display is good with brighter or dimmer options.,Positive
4148,i had it 3 weeks and the screen died i had to buy a new one,Positive
4149,display is awesome.,Positive
4150,the touch screen makes it easier to manipulate.,Neutral
4151,"running speed: normally, the desktop is now displayed in 7 seconds after booting! | screen effect: screen 1080 playing ultra-high-definition no problem. | the 15-inch screen is very comfortable to watch movies.",Positive
4152,"i wanted something slim, versatile with several added features like touchscreen. | it truly does everything i need and the hd screen makes the color pop!",Neutral
4153,good screen quality.,Positive
4154,"my needs-to-have list was good screen fhd, preferably thin, at least able to play a game like lol etc, and affordable.",Positive
4155,nice big screen to work from work.,Positive
4156,"aluminum cover is awesome, screen clarity is awesome,.",Positive
4157,"this chrome book connected instantly to our wifi, was easy to set up between the different users in our household and has a crystal clear screen.",Positive
4158,this is a replacement for one that went black screen on me in in just a couple of weeks.,Negative
4159,screen too small cannot add multiple screens n just to basics for needs,Negative
4160,have not tried much else......the large screen is a plus,Positive
4161,"with the caps and number locks, there is no indicator on the screen nor is there a light that lets you know if these are activated or not.",Positive
4162,"pretty lightweight, boots up fast, screen looks good. | have had several instances where i am watching youtube and the screen will freeze.",Positive
4163,screen quality is good.,Positive
4164,flipping it to screen only does not work for gaming apps.,Neutral
4165,two months later the key pad was completely dysfunctional and when the screen was bent the sound was affected.,Positive
4166,"the trackpad, the keyboard, the screen, the performance, the battery life, all great ",Positive
4167,the screen is amazing and gta5 at max settings gets me between 70 and 130 fps online.,Positive
4168,"very light, great screen, ssd drive and another spot for additional, up-gradable memory, i increased to 12 gig, plenty fast..i needed a windows machine due to microsoft ending support for windows 7 which i love.",Positive
4169,the screen quality is superb with the oled screen!,Positive
4170,"the second day, the screen started shaking and scrolling like someone was touching really fast.",Positive
4171,"blurry, patchy screen.",Neutral
4172,"screen is decent, performance acceptable, sound ok, keyboard comfortable, internet connection flawless, battery life not test yet, form factor lightweight and price cheaper.",Positive
4173,"screen's nice, form factor is decent and performance is good.",Positive
4174,"good laptop, easy to remove type s configuration, nice screen but keyboard backlite keys are almost worthless, not near enough brightness and letters are small but keys have a good feel.",Positive
4175,"this laptop is definitely under priced… the screen is beautiful the build is beautiful and the keyboard is backlit… i own a macbook pro in the keyboard on this one is way brighter than mine, so worth the price point definitely would buy again",Positive
4176,"finally, i just opened my laptop, which is in a hard plastic case, to find that the screen was broken internally and completely ruined.",Negative
4177,"easy to navigate, great quality, she loves the touchscreen feature. | the screen size is a decent size for her school needs.",Positive
4178,screen is good.,Positive
4179,i need for work and it was not a clear enough resolution.,Negative
4180,"this ssd laptop is fast, light and has a bright, sharp screen.",Positive
4181,the slim flys and the screen is clear!,Positive
4182,i am used to having bigger screen and was worried if it will not work for me.,Neutral
4183,like the backlit keys and screen size clarity and a goid value,Neutral
4184,"clear screen, fast processor, no frills and easy start up.",Positive
4185,"has a reliable reputation, bright af screen, sturdy chassis, 16gb ram is good enough for most users so it is pretty damn fast, and just an overall well rounded computer.",Positive
4186,the computer has an intermittent problem since i received the computer a month ago it has just blacked out 6 times when this happens the screen goes black and all the buttons do not work i have to hold down the power for ten seconds and do a hard reboot to get it back.,Negative
4187,the screen is full high definition and looks very sharp.,Positive
4188,"in my opinion, the lg gram is the only option on the market if you are seeking a thin and light device w/ a large display & solid performance. | no other laptop does it all while being this light w/ this large of a display.",Positive
4189,i like the size of the screen and i wanted a number pad. | the screen and top of the laptop have a lot of flex; i fear this could be a problem in the future.,Positive
4190,"the display is stunning. | the brightness and black levels on the display are awesome. | you will hear about ""the notch"" at the top of the screen where the camera is. | they got rid of the touch screen bar at the top of the keyboard from previous pro macbooks and put back the regular mechanical keys for the controls. | i can plut into a giant monitor if i want a bigger screen - it works great on my 34 inch ips panel. | i finally upgraded from my 2015 macbook pro because this new one hits so many sweet spots - revolutionary power and battery life, excellent ergonomic design, great sound, stunning display - its the whole package.",Positive
4191,"has a great battery, and screen.",Positive
4192,it has a beautiful screen display.,Positive
4193,"i prefer laptops to tablets or having to do everything on my phone, because i like having an actual keyboard and a decent sized screen, not a touchscreen (tablet) or a little tiny screen (phone) all in all, it is a great little laptop for the price.",Positive
4194,"the first one bluescreened after about a week of use. | restored to factory settings then updated and it blue screened a second time. | received a replacement laptop and it again just after 2 days of use bluescreened again. | i again per its instructions reset to factory specs, updated again and again... it blue screened.",Positive
4195,"if you are looking for a computer that is not going to break the bank, easy to use, and has a great display this is the computer for you.",Positive
4196,"not touch screen,runs on old os, lags constantly.",Positive
4197,"it is fast and the screen is really sharp, probably my favorite part. | i would say it is a great buy for anyone going into college that wants something cheap, but reliable, with a nice screen.",Positive
4198,"bought mines november 26,2021 and it is february 10,2022 and it just does not want to turn on nor charge nothing it is sad because i was using this for school work and out of the blue never been dropped nor touched by children it has been completely been in my care since day one i placed a screen protector i have a keyboard protector i have not downloaded anything but my cricut design software and kindle i rearly use it since i want it to last yet today i open it to use it with a new pen i purchased for it and it will not turn on nor will not charge and it is not the charger because it worked on my phone since i know it is the same plug i do not use it to charge my phone nor do i over charge it because i am very picky with my stuff.",Negative
4199,i was concerned about the screen quality because others complained. | if you get the vertical viewing angle right the screen is bright and the color is rich.,Positive
4200,"the outside got scratched up super easy, touchscreen works battery runs low quickly but of course my kids are doing lots of work / schoolwork on it. | they like the touch screen thou.",Positive
4201,this computer has no touchscreen qualities.,Neutral
4202,"in july, the unit boots up but the screen remains blank.",Neutral
4203,had a blue line down the center of the screen,Negative
4204,the screen resolution is amazing!!!!,Positive
4205,( ps it is not touchscreen so not quite sure why it is mentioned as a metric here),Positive
4206,"screen works well, not the brightest but plenty bright, and the speakers are good enough (not super loud).",Positive
4207,it has a nice screen quality.,Positive
4208,"i was very excited by this laptop, as i have not had one with a bigger screen in quite a while (and have never had one with a backlit keyboard; fancy!).",Positive
