,Display Sentences,Display Polarity
0,love being able to use either touch screen or key board. | both screen quality & battery life are impressive.,Positive
1,screen is a little bit less bright.,Positive
2,the display is great and very lightweight.,Positive
3,"all in all it can be a little cheaper for what you get, considering the screen is not the best and a tad dark and dull compared to an hp model i have that is similar.",Positive
4,"this laptop flies at every basic day to day task even in dual screens, i play some games like fortnite, minecraft dungeons and halo master chief collection as well as some games on xbox game pass as i have an xbox, i have used photoshop 3 layers max, illustrator 3 layers max and primere pro for basic stuff and it runs 1 adobe program smooth with 8gb ram or 3-4 with 16gb of ram at a time depending on how much ram you have installed, but it can be upgraded to 32gb ram max to do more especially with layers in adobe. | take it out of s mode which i did from day one and the screen is very clear and better on my external monitor, keyboard is amazing in the dark as its backlit and the mouse pad is great...it really beats the i5 8th gen because the gpu is better especially in games where fortnite and halo would skip frames.......overall for a budget i give it 4.5",Positive
5,"does not open up for a long time, grey screen, missing screen items you name it.",Negative
6,i thought this laptop was touch screen.. it is not..i need touchscreen for my husband who has parkinson’s,Neutral
7,after a day i was able to set it up and got it running but it ran slow and the screen froze multiple times.,Positive
8,i gave it 4 stars because it does not have too much ram and the screen quality is not like amazing but that is expected for the price.,Positive
9,"excellent quality price, it is very fast the screen it is good, the sensor fingerprint is very useful and fast.",Positive
10,the screen on the laptop is big and looks great.,Positive
11,"the bonus 15.4"" screen gives me a nice view of my documents, powerpoints and spreadsheets.",Positive
12,the screen was the deal maker there for me. | most everything else for this price level has trash screens.,Positive
13,screen quality is great!,Positive
14,"when viewing the pictures on the left side of the screen it shows a finger printing button on the right lower side, however, this laptop does not come with it, hence, it should not show a picture of another laptop, which could be construed as false advertising.",Negative
15,colors on the screen excellent.,Positive
16,"the 2nd screenshot is after running around in destiny 2 in the throne world of the new expansion. | the screen while a 1080p resolution is silky smooth with the 144mhz refresh rate. | i actually prefer the laptopscreen over my desktop setup, but other than that i barely notice any differences in quality between the 2 machines.",Positive
17,the screen really is as good as the others say.,Positive
18,great screen.,Positive
19,"i love that the screen comes with rich colors and saturation, not many can say about most moderate gaming laptops these days. | the screen is eye friendly as you can turn down brightness to your choosing.",Positive
20,"the performance is amazing, the screen displays great, it is lightweight, and the battery lasts for like 12 hours of continuous use.",Positive
21,"i liked the size of the screen, is fast very fast, i used to work in a dell but drive me crazy how slow was.",Positive
22,the screen is clear and bright.,Positive
23,"the other features are just what you expect them to be: super light, portable, hi-res screen.",Positive
24,"processors, ram, gpu's, display, screen size, etc., so many things to consider.",Positive
25,i am amazed with the performance screen quality.,Neutral
26,"i like it and all but micro soft is not programmed on here, and it is not a freaking touching screen as they say it is.",Positive
27,this laptop only lasted me 5 months before the screen went completely black and now it will not turn on. | it started with the screen blackening in and out while i am in the middle of working or browsing webs.,Negative
28,"this laptop is surprisingly good for the price point, multiple tabs open, relatively responsive touch screen, plenty of storage considering i do not download a lot.",Positive
29,is the screen resolution great? | are there some areas of the screen that are just a weird teal color when they should not be?,Positive
30,not a touch screen.,Neutral
31,it then went black screen.,Negative
32,"it had exactly what i wanted, a 15"" screen (for portability) and a numpad, which is not very common for the size.",Positive
33,the screen quality is great!!,Positive
34,it has a beautiful display and keyboard and has the resources to play every game we have thrown at it.,Positive
35,"my wife and daughter purchased laptops that cost 3x as much and other than not having a touch screen, the acer laptop performs equally as good!",Positive
36,"at the shop, they were much more responsive but warned that a small crack in the bottom of the screen that happened when i close it one day likely caused the problem, would not be covered by the warranty and would cost $700 to fix. | two issues with my 2020 apple macbook pro with apple m1 chip (13-inch, 8gb ram, 256gb ssd storage): 1) debris can fall into the seam between the keyboard and screen unseen and 2) i kept having to adjust the brightness; even though i set the screen to be bright, it kept returning to dim. | the tech at the shop said he sees a lot of screen issues and highly recommended by the warranty-plus plan, which costs over $200, for two years, i think, and then $100/year.",Positive
37,"this laptop flies at every basic day to day task even in dual screens, i play some games like fortnite, minecraft dungeons and halo master chief collection as well as some games on xbox game pass as i have an xbox, i have used photoshop 3 layers max, illustrator 3 layers max and primere pro for basic stuff and it runs 1 adobe program smooth with 8gb ram or 3-4 with 16gb of ram at a time depending on how much ram you have installed, but it can be upgraded to 32gb ram max to do more especially with layers in adobe. | take it out of s mode which i did from day one and the screen is very clear and better on my external monitor, keyboard is amazing in the dark as its backlit and the mouse pad is great...it really beats the i5 8th gen because the gpu is better especially in games where fortnite and halo would skip frames.......overall for a budget i give it 4.5",Positive
38,the screen is very sharp and it is wonderful for gaming.,Positive
39,it is light and thin with a great screen and keyboard.,Positive
40,"performance so far has been great, long battery life, excellent screen clarity and very good speed for what they are using it for.",Positive
41,welp had trouble connecting to internet did total restart now its suck on wifi screen will not go any further,Negative
42,it is very fast and the screen is awesome. | bezels are thin and the screen is bright.,Positive
43,"the computer works pretty well, but the touchscreen randomly stops working.",Negative
44,"it has a well lit keyboard, screen images are good, and downloads are smooth.",Positive
45,cova 19 came about so i did not take the coverage glad i did not take it life is tight but the schools shut down did not have much time to do any thing but i thought this would be good the j button works if you push it hard back light is crap and no touch screen,Positive
46,led screen is awesome; the m1 achip is very fast for my type of usage,Positive
47,it also has a super display and keyboard is not cheap feeling.,Positive
48,the screen is great and it works perfectly as far as games but now its cant be used at all .,Positive
49,the screen quality is of moderate issue/concern.,Neutral
50,"is so fancy, great resolution and is perfect for my work, is super fast and i had no problem with the shipping.",Positive
51,this is a very nice computer for the price i have had no complaints and it has given me 0 trouble i really like all the functions on this computer it can be turned into a tablet also and it has a touch screen you really cannot go wrong with this computer,Positive
52,really simplistic in design and is light weight and durable (it probably can handle a modest accident without breaking or the screen shattering). | the screen does not wobble like some other 2in1's. | the screen resolution is about as good as the original kindle fire hd resolution circa 2012 - pretty much years behind to the current technology resolution.,Positive
53,"the hd screen is cool, but what good is an hd screen when hd video streaming causes it to lag horribly?",Positive
54,"i did effect a factory reset using the screen keyboard, but the physical keyboard problem continued.",Neutral
55,"the laptop itself is amazing for what it was bought for to play newer titles at higher frames, it does so on ultra high settings running with vsync at the monitors good 144hz monitor, screen quality is great and the 144hz makes it that much better.",Positive
56,i bought it actually because my old laptop was having difficulty closing the screen because the hinge somehow broke from the screen.,Positive
57,"very light, great screen resolution, has all the basic features i needed.",Positive
58,less than three months and getting a black screen.,Negative
59,great quality and screen resolution is excellent.,Positive
60,it packs a punch in terms of quality and display.,Neutral
61,"the screen is great, the keyboard, the design, the layout, nearly everything reached my expectations, many things are customizable too.",Positive
62,good screen quality.,Positive
63,"i expected better, do not think it will last long, already seeing screen issues.",Positive
64,amazing for a 15.6 screen size and full backlit keyboard.,Positive
65,"pro: fast processor, light weight, great screen, and no challenges.",Positive
66,"i will go straight to the point here, at the retail price of $350 you are mostly getting a nice display.",Positive
67,"the touch screen works really well, it turns on and loads up fast, surf's the net fast, can download stuff from google play , and the battery lasts a long time.",Positive
68,it is basically been a screen to display knitting patterns and browse the web.,Neutral
69,"it looks like it is working but there is only a black screen in the image window- for both camera and video. | on zoom calls, it looks like the video is working but there is nothing but a black screen. | searches on both the acer community forum on their website and google in general show multiple users all reporting the same exact problem- and following all of the same steps, with absolutely no resolution. | this is the first (and hopefully only time) that i have had one stop functioning in less than 4 months after purchase- with no viable resolution offered by the company.",Negative
70,"bought this in march of this year, now reach october and the screen went dead!",Negative
71,the screen is crisp and clear and the finish is sleek and light.,Positive
72,cute unit--but does not work after two hours = black screen & dead,Positive
73,had a blue line down the center of the screen,Negative
74,"the laptop display, keyboard and touch pad are all great.",Positive
75,"i liked it at first, but after a couple of months a grey line appeared on the screen and the hd started to make a noise.",Positive
76,"it is fast, the keys light up, screen is high resolution and bright, light and slim also perfect size.",Positive
77,"i was trying to use this chromebook for my zoom lectures, but the touchscreen is so terrible to write anything on it (i initially thought it is my stylus, but i tried three different stylus, and they all wrote like this)",Negative
78,"no touchscreen, whatever.",Neutral
79,opened my brand new $1000++ computer and the entire screen was cracked and destroyed.,Positive
80,"i mean it is a chromebook, they are the only computers i buy at this point but seriously a touchscreen to boot for $200?!? | only downside is that i find myself trying to scroll down like a touchscreen on my work hp computer because that feature makes getting work done so very seamless. | i have used this paired with my bluetooth devices to do indoor bike training and it works like a charm to record workouts with a much better screen to read than my phone.",Positive
81,sometimes it locks up on a black screen - i use the power button + refresh to restart it. | i do not use the touchscreen very often but have had no issue with it when i do.,Positive
82,i have never had a game running so smooth before.no lags or cuts anywhere.it had expandable storage so i bought a 2tb sata hdd and it was soo easy to install.i have only had this laptop for 6 months and so far it is worth every penny.all recent aaa games runs smoothly with a high refresh rate at highest configurations...the 144hz screen does have its charm.there is no disadvantage in buying this laptop but the speakers need to be pointed out though.although i only use headphones...the speaker quality could have used some improvements.,Positive
83,"that being said, after complaining for several days, my husband informed me that it is a touch screen so now i scroll that way and it is easier.",Neutral
84,screen is quite large and lighted keys upon touch is nice when using in poor lighting.,Positive
85,excellent screen.,Positive
86,i like everything but i have not use for game and the touchscreen yet so i cannot comment that part.,Negative
87,"it is sturdy but not bulky, and the screen is so much easier on my eyes than the tablet i had been using.",Positive
88,let me start by saying the screen is beautiful!!!! | those full hd lenovos at this same price point have washed out screens. | this acer screen is amazing.,Positive
89,"this laptop did not even last 30 days, as it has been stuck in reloading blue screen and it does not turn on.",Neutral
90,"it is much thinner than i expected, and the screen has almost no ghosting at 144hz. | the bezels in the screen are super thin, one finger opening if great if you have got something in your hands.",Positive
91,"i wanted a thin profile, matted screen and 1080p resolution.",Negative
92,second screen compatible.,Neutral
93,great screen.,Positive
94,"secondly, after using it for a few days, it suddenly goes into a black screen and i am still struggling to get it to work.",Negative
95,"the battery life is really long, i love how bright the screen is, and my favorite thing so far is the keyboard.",Positive
96,"the touch screen was not very sensitive, and it would take a long time to boot up.",Negative
97,"the screen is plain old hd, but you cannot have everything at that price point and type is still reasonably crisp. | if i had to nitpick i would say that i do not like that the acer logo is so prominent in the bezel, or that it says corning gorilla glass at the top of the screen--i do not need logos and type drawing my focus when i am on task.",Positive
98,the keyboard & touchscreen are great. | cannot adjust the screen resolution to play my addictions.,Positive
99,"i did not realize when i bought it that it was not touch screen. | i thought all new computers were touchscreen. | the screen is not as bright as my previous dell but the acer is much, much faster to boot and does not have cache problems and does have lighted keyboard.",Positive
100,edit: 4 months after purchase the screen has died completely and now i have to send it asus for them to repair under warranty with an estimated time of 6 months.,Positive
101,screen is very large and nice.,Positive
102,she really likes it and i did not realize it was touch screen when it was ordered!,Positive
103,"i tried this multiple times, and each time all i got was a black screen.",Negative
104,i had not realized the screen resolution was so low when i purchased to sent it back.,Neutral
105,"absolutely love it, not a heavy gamer but works great with screen res.",Positive
106,i also got the 16 inch screen and i do not think i could ever go back to a 13 inch screen! | it so big and very easy to see the powerpoint on zoom while also taking notes on the same screen.,Positive
107,it is super compact and light to take anywhere for those quick spur of the moment graphic ideas and get those ideas on the screen. | the screen comes up clean ready for you.,Positive
108,"i am unsure if this laptop is supposed to be touch screen but mine is not, which i am okay with.",Positive
109,it had instability: frequent loss of control of cursor and weird screen behavior.,Negative
110,i just got the computer and came right on time turn it on it was a breeze nice bright led screen the memory small so you should really looking into upgrading that and if you did not know already buy a mouse!,Positive
111,the screen size is perfect and having the number pad on the keyboard helps with calculating formulas and entering number data.,Positive
112,i bought this notebook for a project and the keyboard and screen work very well but it is limited to certain apps that i need to complete my project.,Positive
113,"love the display, the keyboard, back light.",Positive
114,"the plastic frame around the screen buckled, bowed and unsnapped (it is a two pc plastic frame front and back a that snaps together around the screen, and may be glued together but not molded together. | for the plastic screen, i could at my cost mail it back to acer and they would fix it , and it may be at a cost to me if determined not to be their defect, and my damage, that is understood as i did not damage it) but that i would be without it for up to 3 weeks.",Neutral
115,this is a replacement for one that went black screen on me in in just a couple of weeks.,Negative
116,"the 15"" made good use of keyboard space with an fps screen.",Positive
117,"same sleek design, very good screen, same materials and build quality, and all the latest tech inside along with windows 10 home once you switch out of s mode.",Positive
118,"they are much more expensive, but what they make up for in build quality, the keyboard feel, battery life and display resolution, they are well worth the extra that you pay.",Positive
119,"the reported dimensions of this screen are pretty deceptive. | what you actually receive is one of the more narrow aspect ratios of usable screen space i have ever seen in a touchscreen device. | the screen is also pretty dark even at the brightest level compared to my other tablets and laptops. | trying to use it in tablet mode with how average website are designed was pretty impossible with the aspect ratio making the screen so narrow and long. | i bought it as a gift for someone and was so put off by how it looked in tablet mode and the incredible cheap plastic built with large seams on the body all over the place ready to pop open, that i returned it for something more solid and honest about screen quality.",Positive
120,it did disappoint that it was a 60-hertz display. | the computer is powerful so i hoped it had a 144 or 240hz display.,Positive
121,"the screen is very clear and clean. | all in all, i do recommend this laptop for it is price, efficiency, super clear screen, and the back-lit keyboard.",Positive
122,"fast, light, compact, excellent screen display.",Positive
123,picture screen quality is excellent.,Positive
124,i bought one for my 5th grader during virtual learning because i was sick of them using the tiny screen of the chromebook.,Negative
125,the matte screen is ideal for viewing in bright light.,Positive
126,i shut the computer thinking that would help...nope now nothing shows up but a black screen.,Negative
127,the screen quality is fantastic.,Positive
128,very good laptop :) my boyfriend doesnt leave it even for a sec.... he always plays he games and use this laptop till it dies :) very clear hd display keys are smooth,Positive
129,the screen quality is great and the keyboard light is also very convenient.,Positive
130,the screen is very cheap.,Positive
131,"the screen, the lighting, the keyboard light, the ease, the speed.",Positive
132,"it is not touch screen, which is fine. | she is in gifted and will be taking concurrent college classes when she starts high school next year, at that point, we will get her a different one that is touch screen and has more features.",Positive
133,the screen is really high quality and it is descently fast.,Positive
134,"amazing computer for the price, very lightweight, fast, and touchscreen!!",Positive
135,"aug 2022 updated edit: 4 months later, display is dying.",Neutral
136,expandable hard drive and crystal clear screen.,Negative
137,in terms of functionality it works very well and is capable my only qualm is the screen which changes color at every shift and feels fake so just beware if you are doing visual work,Negative
138,"great price, fast laptop, great screen quality.",Positive
139,"i wish that the display was 4k, and that the body was a little more premium, but for the price you cannot beat the top-of the line specs!",Positive
140,the touch screen really puts this laptop over the line!,Positive
141,the convertible function is well-designed and touch screen is responsive.,Neutral
142,well after just a few month of having it the screen went completely crazy and i cannot see anything. | i was using it to watch netflix got a pop up saying it needed to restart for new software and after that the screen was so distorted i could not see a thing.,Negative
143,the laptop is not touchscreen and not for gaming. | the screen quality is exceptional and shows netflix oh so well!,Positive
144,"it is fast, the display is beautiful, it is easy to use and well worth the price.",Positive
145,the most gorgeous display you will ever find at $300.00.,Positive
146,the screen keeps flickering and the touch pad works sometimes.,Neutral
147,"for example, as others have stated - no good ports (you need to buy all kinds of attachments), no touchscreen, etc.",Negative
148,at first i liked i expected it to be a little bigger but it was small easy to carry and go on to go the touch screen never worked but i was okay with that the real problems came on like the 8th day after having it for one it does not charge unless it is all even when powered off it barely charged i would have it on the charger for over 5 hours to get on there and only have 20% the keyboard layout constantly changes on you to as though you will have constant problems with your password and will end up having to use guest mode i do not suggest this product at all,Positive
149,"the screen quality is good, it is light weight & easy to carry around.",Positive
150,"running speed: normally, the desktop is now displayed in 7 seconds after booting! | screen effect: screen 1080 playing ultra-high-definition no problem. | the 15-inch screen is very comfortable to watch movies.",Positive
151,then all the sudden black screen the wont power on.,Negative
152,touch screen and resolution is decent.,Positive
153,screen quality is great and battery lasts long it takes me a couple of days before putting it on a charger,Positive
154,the screen was broken when i got it in the mail. | and wanted to charge me 280 dollars to replace the screen of a 300 dollar laptop...not at all pleased.,Positive
155,15” screen is good too.,Positive
156,"awesome laptop for the value, very quick and great screen quality.",Positive
157,"it does not game, it has no touch screen but the visuals and the effort into creating the almost perfect man/woman who wants it there and then?",Positive
158,"despite the advertising and manufacturer confirmation, received laptop with 60hz screen, not the 144hz in the listing.",Neutral
159,1 of them came with the screen cracked. | it looks like the damn age is on the inside of the computer screen.,Neutral
160,the screen is great too love the picture quality and it gets brights.,Positive
161,easy accessibility on the underside for upgrading and good screen quality.,Positive
162,"sleek design, 15.6” screen but able to fit into 14” laptop case.",Positive
163,honestly my only compliant with this little laptop is the lack of touch screen.,Negative
164,he likes the touch screen and most of the kids in his 7th grade class have chromebook laptops. | overall very pleased with this touch screen laptop and would recommend for 5th grade and above.,Positive
165,he absolutely loves this because it flips over with the touch screen.,Positive
166,the screen quality is over the top.,Positive
167,"i had one minor screen hinge issue, but with the added amazon warranty, it was fixed fast and ""free""!",Positive
168,it is a full hd display and the color is much warmer and more realistic than the screen on the laptop. | the resolution seems fine but the color is somewhat drab.,Positive
169,"loved everything about the laptop until one day, only 10 months after purchasing, the screen was black when i turned it on.",Positive
170,very happy with screen and battery life.,Positive
171,"i bought this laptop for my son and he liked it very much, great performance and screen quality is top notch.",Positive
172,it does just about everything i need it to and the touchscreen works fine.,Positive
173,screen is nice and big so it also works really well to watch your favorite programs. | my problem began a few months ago when a tiny part of the plastic broke on the right bottom corner of the screen. | but the last 2 months of use it i have needed to prop something heavy behind the screen to hold it up because otherwise it just falls and breaks even more. | anyway when i was trying to fix the sockets that popped out of place i guess a wire that was exposed ripped or something because the screen no longer turns on sadly.,Negative
174,"light weight, flat and good color screen. | i am not a gamer and it is not touch screen.",Positive
