,Display Sentences,Display Polarity
1398,"laptop works good, great performance for the value, however the screen quality could be better and the camera quality sucks.",Positive
1399,it is lightweight and has a good size screen.,Positive
1400,"i have an higher end hp touchscreen, but it is slow as molasses.",Negative
1401,"it had terible display, pity battery life. | on the other hand this laptop has beautiful, crisp, display, it is lightweight, thin, the battery life is even better than producer said, beautiful lighted keybord, fast wifi and for this price it does not look cheap at all because of its beautiful alluminium cover.",Positive
1402,the fit and finish is excellent as well as the screen size and image quality.,Positive
1403,the screen quality an display was great crisp clear bold everything you would expect from a high end laptop but on a chromebook.,Positive
1404,"the laptop display, keyboard and touch pad are all great.",Positive
1405,"the 144hz display is noticeably improved from the previous laptop's screen, and the rtx 2070 has already allowed some seriously cool gaming on the highest settings!",Positive
1406,the screen is awesome the memory hard drive is not enough for gaming,Positive
1407,returned screen went black was told by support id have to reinstall windows.,Negative
1408,"good for the price .. touchscreen need a slightly harder press than other manufacturers, camera is kind of dark .",Positive
1409,the screen is of nice quality. | the touch screen is responsive.,Positive
1410,the screen has good viewing angles.,Positive
1411,it does not have a touch screen but i have had it for 4 months and it is been fantastic.,Positive
1412,the screen on the button is open up like its no longer glued.,Neutral
1413,it also has trouble displaying videos on my multi screen set up...,Negative
1414,the screen is worse that what i had hoped for.,Negative
1415,buttons did not really work and screen sometimes is hard to work,Negative
1416,"love backlit keyboard, screen is vivid!",Positive
1417,"screen, keyboard, and exterior finish all appear to be high quality.",Positive
1418,great screen quality.,Positive
1419,"it had terible display, pity battery life. | on the other hand this laptop has beautiful, crisp, display, it is lightweight, thin, the battery life is even better than producer said, beautiful lighted keybord, fast wifi and for this price it does not look cheap at all because of its beautiful alluminium cover.",Positive
1420,screen looked smaller than anticipated.,Neutral
1421,"second chromebook i have bought in the past two months, they both display the error that chrome os is missing or damaged.",Negative
1422,"it froze on this screen, i held down power button now it will not turn on at all.",Negative
1423,it looks nice has a great screen and is lightning fast.,Positive
1424,"i want to start by saying that i love the big screen and microsoft office runs well on the computer, but for the life of me i cannot figure out why it is so fickle when it comes to wifi connectivity.",Positive
1425,"light weight, flat and good color screen. | i am not a gamer and it is not touch screen.",Positive
1426,"i love the bright, crisp screen, the backlit keyboard, and sleek brushed aluminum look.",Positive
1427,screen is small but we should have realized before ordering,Negative
1428,"the ryzen chip performs quite well and slowly sips on the battery, giving plenty of power to not only run office apps, surf the web, but also play modern games which is uncommon for touchscreen laptops. | the screen is a bit glossy so using it in bright light can cause some reflections and it does show fingerprints a bit more than a matte screen. | both the screen and the trackpad are responsive multi-touch devices and work well. | and the screen supports an optional palm rejection stylus which is great for sketching and drawing.",Positive
1429,love the screen!,Positive
1430,it is able to go from serious work to entertainment with the flip of a screen and is capable of most everything you need to do on it as far as basic office work goes. | this is highly affordable and fun to use in every way and has a tough and really impressive display.,Positive
1431,screen locked up.,Neutral
1432,great screen.,Positive
1433,"half the screen on the laptop went dead within a couple of weeks. | the laptop set on a desk, we did not travel with it, drop it, move it around or anything that would have damaged the screen. | the screen did not appear to be physically damaged so we contacted acer who said to send it in for an evaluation and repair. | they wanted $250 to replace the screen for a $350 laptop.",Negative
1434,screen looks great . | i have googled how to try and get screen back on .,Positive
1435,"after using the laptop for a while, when i would open it, i heard a cracking sound more and more, and now, approximately only two years later, it will not close fully because the plastic that holds the screen in one area has warped and separated from the screen.",Positive
1436,"i love the screen , you will never do back to a lie refresh rate when you try this types of screens.",Positive
1437,secondly the screen quality was actually terrible.,Negative
1438,"great picture, no touchscreen and i am not sure about gaming though daughter does not use it for that.",Positive
1439,not a touch screen and where is my refund i sent it back at least five days ago six days ago?,Negative
1440,"it froze on this screen, i held down power button now it will not turn on at all.",Negative
1441,"the screen quality is pretty nice, and the touch screen works well mostly as long as you do not touch it too lightly or too heavily.",Positive
1442,the screen is gorgeous for the price point.,Positive
1443,"quality, fast start up, great screen, lightweight w great battery life!",Positive
1444,love the screen.,Positive
1445,the part that attaches the screen to the key board hinge is separating. | i have never done anything but close the screen and set this on a table.,Neutral
1446,there was an area of the screen that has this rectangle of light that shines through as soon as it was opened and turned on (which makes me wonder if it was somehow damaged).,Positive
1447,"this is my 2nd acer computer, my previous one was a dell with a touchscreen which i never really liked, ever.",Negative
1448,touch screen is a great convenience over my current pc.,Positive
1449,"the back of the screen is metal, but the rest is plastic, which is fine for the price.",Positive
1450,only set back is the display is a little off for me.,Negative
1451,nice bright screen.,Positive
1452,large screen but not a touchscreen.,Positive
1453,nice sized screen.,Positive
1454,10th gen. screen is not all that great for movie but work is suitable for the price.,Positive
1455,"however, today, the screen is starting to lose resolution, and gets all shaky and blurry.",Negative
1456,i wish the screen quality was a little sharper. | i guess i am use to the apple computer screen that why.,Negative
1457,"this budget laptop features windows 11, and a nice, large 15"" 1080p display. | the display has thin borders on two side to give the laptop a clean, modern look.",Positive
1458,screen quality excellent.,Positive
1459,"and after do that a coup times, the device shows a blue screen and cannot to open.",Neutral
1460,walked away for a bit and came back to it with a black screen. | i assumed it went to sleep or the screen turned off.,Negative
1461,"so far i really like this computer, the screen and keyboard are both really great.",Positive
1462,when the screen began wiggly/jumping around.,Neutral
1463,"the screen is very good, to be honest i was very surprised, its quality is quite clear the colors are not appreciated false or over saturated, the image quality it offers is something that will fascinate you outdoors because you have to look for a good angle of that shape will not be affected, the brightness is decent if you want to lower it to a minimum and when you choose to upload it to the maximum you will appreciate the clear images without perceiving that feeling of discomfort.",Positive
1464,"the touch screen is great, and very responsive. | i can use the touch screen in lieu of the keyboard, if i wish. | the screen is a high quality and very durable.",Positive
1465,keeps restarting and black screen every 2 mins.,Negative
1466,mine arrived with a screen that would not turn on.,Neutral
1467,the screen quality is not enough for watching good resolution movies or playing games.,Positive
1468,"first, when i closed the screen for a moments break and returned, the cursor would have disappeared, reappearing whenever it was ready, usually after a minute or two. | i had to sign in on the touch screen (also frustrating).",Negative
1469,this computer is so compact with a large screen.,Positive
1470,screen does leave me a bit wanting with viewing angles and such however this thing holds its own.,Positive
1471,the touchscreen is pretty sensitive too.,Positive
1472,"after about 9 months of light use (med student) this laptop is already shutting down on its own, freezing, and screen is not turning on (all in the absence of any viruses).",Positive
1473,screen is great so are the speakers.,Positive
1474,even when it was working the touch screen was iffy and did not always work.,Neutral
1475,"screen is clear/bright and large, set-up is very easy, sound quality is fine.",Positive
1476,"my two complaints are, 1) the windows product key was not properly installed so i was locked out of some feature and had an annoying activate windows text floating over all screens at all times, and 2) the speakers are not great.",Negative
1477,"it is so easy, fast, sleek, great keyboard for fast typing, great screen quality and more.",Positive
1478,the back is loosing off after just a month of use and the screen has started to jump from time to time.,Neutral
1479,"there is a display board on the keyboard that can be displayed, which can control the volume and other operations. | the screen of the computer is also good, and it is very smooth to use.",Positive
1480,it has just a little bitty dot that is lighter than the whole screen like it has been touched hard and it left a small mark there .,Negative
1481,the display is great.,Positive
1482,"yay, spent a g on a new grey screen of death.",Negative
1483,it is not touch screen. | picture display quality is pristine.,Neutral
1484,"i bought this computer after doing lots of research on it and i have to say it is great,,,, needs 4 more megs of ram memory which is like 20.00 bucks here on amazon and do away with windows s mode and you have a great machine,,,, the screen is good and bright enough,,,, the machine works great,,, and other than the 2 things i spoke of,,,both are easily fixed,, it is great for the price,,,,very happy!",Positive
1485,screen seems to have one pixel damaged. | screen shows a small green dot when screen is dark.,Negative
1486,"it is thin, lightweight, holds a charge, and has good resolution.",Positive
1487,we knew what we were getting into with the smaller screen size but the performance is just awful on this device.,Negative
1488,"as some of the other reviews have mentioned, the laptop is very loud - opening a browser, loud; opening word or powerpoint, loud; simply on the home screen; loud.",Positive
1489,screen is only 1080 but super crisp.,Positive
1490,the only problem is the resolution on the camera/video is not good.,Negative
1491,i do not mind that it does not have a backlit keyboard or that it is not touchscreen.,Neutral
1492,"i love it, everything about it, for one the screen quality is beautiful and it has a backlit keyboard. | i did not see anything about a touchscreen in the description, i am not a fan of touchscreen anyway.",Positive
1493,well i saw this on sale and gave it a try first of all it is 8 gb ram and has an intel chip touchscreen and light up keyboard.,Positive
1494,especially the 144hz screen.,Neutral
1495,"the screen is beautiful, keyboard is easy to use, battery lasts a good while, it is light , it is portable and it is quite thin.",Positive
1496,"the computer is used, broken and also screen lock from another user .. i am so disappointed.",Negative
1497,"it looks like it is working but there is only a black screen in the image window- for both camera and video. | on zoom calls, it looks like the video is working but there is nothing but a black screen. | searches on both the acer community forum on their website and google in general show multiple users all reporting the same exact problem- and following all of the same steps, with absolutely no resolution. | this is the first (and hopefully only time) that i have had one stop functioning in less than 4 months after purchase- with no viable resolution offered by the company.",Negative
1498,i like the definition of the screen and the backlit keyboard.,Neutral
1499,"sometimes too the screen goes black but the computer is on, so i have to shut down the computer and restart.",Negative
1500,advertised as touch screen in amazon description. | was not and amazon basically tells you sorry but it is not and they cannot fix it to be a touch screen device (obviously) and will not acknowledge or correct the description error. | if you are looking for a touch screen do not purchase this item.,Negative
1501,"1080p ips screen, 128gb m.2 ssd, ryzen 3rd generation cpu, vega 3 graphics (serviceable for integrated graphics), 2 ram slots for dual channel memory, expansion for another traditional 2.5 hdd/ssd.",Neutral
1502,i like the screen and the weight.,Neutral
1503,"battery life is fantastic, screen is nice and large, mouse pad is perfect and the unit is very light.",Positive
1504,"the touch screen is such a bonus on this inexpensive, super light-weight laptop. | i am very happy with screen quality and size as well as the sound quality.",Positive
1505,"i like the size of the screen, speed , quality.",Neutral
1506,"i would have initially reviewed this as 5 stars, based on the display quality, speed, case and keyboard. | right after my 1-year warranty expired, the screen started routinely flickering.",Positive
1507,"beautiful display, fast, and nice keyboard.",Positive
1508,first had about 40% of the screen broken and unreadable. | the second screen was completely broken.,Negative
1509,the screen is clear and crisp with no dead pixels.,Positive
1510,"the screen is the perfect size, it is not too heavy but it does not feel cheap.",Positive
1511,screen quality excellent.,Positive
1512,"after i got over the initial shock of downgrading to a 15"" display from my previous 17"", the screen is of good quality. | no touch screen on my model.",Positive
1513,"a nice, lightweight computer with beautiful screen and nice sounding audio speakers.",Positive
1514,i bought this laptop for my son and so upset that it is not touch screen.,Neutral
1515,the screen is very nice for the price.,Positive
1516,i bought a 23 inch acer monitor and turned the display down on the laptop and placed it on my sliding keyboard drawer.,Negative
1517,the screen is sharp and the laptop is light.,Positive
1518,"screen quality could be a bit better, but it is mostly a work computer.",Positive
1519,i love that you can use the touch screen or the keyboard and both work great.,Positive
1520,"aluminum cover is awesome, screen clarity is awesome,.",Positive
1521,great every day computer for word documents etc and web browsing screen is nice.,Positive
1522,it has just a little bitty dot that is lighter than the whole screen like it has been touched hard and it left a small mark there .,Negative
1523,it was great then overnight it was done for... screen quit working and key board,Positive
1524,"other than that great budget laptop for surfing the web or just watching netflix, nice screen and performance.",Positive
1525,the touch screen is not very responsive.,Negative
1526,"i love the large, clear screen.",Positive
1527,i purchased a new version and i was sent a refurbished one.i found that it was refurbished when i tried adding apps to the laptop.a pop up came on the screen stating certain apps are not compatible with jail broken laptops.,Negative
1528,"it is compact in size, fast, clear screen, and was a great price.",Positive
1529,"screen size is a bit small, but cannot complain for the price with windows 11 and 8gb ram",Negative
1530,the screen display is top notch and with it being windows baded it is compatible with all my other devices as well.,Positive
1531,"i liked this one because of the screen size, the number pad, and well...it is price.",Positive
1532,"it has slim size, light weight and contains m.2 slot for upgrade, hd screen is good for streaming movies, contains numeric keypad, it comes with windows 11 & office365(1yr).",Positive
1533,there is an issue with the screen.,Neutral
1534,"i have been delighted that it is perfect for what i need, brilliant screen, and fast.",Positive
1535,"the screen quality is amazing. | we did not get a touch screen and while we are gamers, we have not used it for such.",Positive
1536,"i am a truck driver that does long hauls so used for watching movies / tv show some gaming had not start yet on gaming,, received mid august 2021. woke up december 08 2021 the screen does not work anymore!! | wtf for over $1000 and is supposed to handle extreme temperatures, my cab does not get below 32° f very disappointed, attempting to troubleshoot but computer does not display built-in screen as option?!?",Negative
1537,corner cracked and screen stopped.,Neutral
1538,"it is very thin and lightweight, the screen is huge, and is appealing looks wise.",Positive
1539,there is an issue with the screen.,Neutral
1540,"awful keyboard, awful trackpad, gorgeous screen, powerful (non-msi) graphic card and processor.",Negative
1541,"maybe it is because i had downgraded from a 144hz screen to a 60hz screen, or maybe because my previous laptop was a performance monster, it just did not feel that good.",Positive
1542,it works quick and the screen quality is great!,Positive
1543,keyboard feels good and so is the screen.,Positive
1544,walked away for a bit and came back to it with a black screen. | i assumed it went to sleep or the screen turned off.,Negative
1545,hate the fat the screen has gone black and will not come back on.,Negative
1546,"very disappointed in this laptop.. lags on all videos (was looking for a dedicated laptop for disney plus), crashed twice now (have had it for 2 days) the screen has a weird low quality hue to it.. my previous $200 asus is far superior.. dont buy (currently the only device in my home that ""cannot connect to this network"") this thing is a joke.",Negative
1547,been having this laptop for about a year decent gaming laptop for the price but the graphics on this are so horrible gta looks better on my ps4 pro on a 60 hz tv than this thing any game it does not matter how old it is the graphics are not good all though it can game to an extent fans will get loud not too bad if you have headphones on but the one thing is the battery life and it is a slim design but the overall build quality is poor my screen bend when my dog pulled the cord and it fell on my lap in my chair overall if you are in college or school and want a slim laptop for school and light gaming this is a good option just do not expect it to be that great for newer games or games that lead off graphics the ray tracing is non existent,Negative
1548,"the problem numerous people have, and which i had, is the area surrounding the screen becoming unglued around the right hinge and so it starts to fall apart when you open and close the screen.",Positive
1549,"i am in love, this gaming laptop is one of the best purchases i have ever made, the screen quality is great, it is very fluid, and runs smoothly.",Positive
1550,"overall this laptop is excellent, lightweight, very fast, screen is vibrant, great value for the money and was delivered ahead of schedule .",Positive
1551,"it is not touch screen btw but i do not for that anyways , either way you wont regret it !",Neutral
1552,i love the touch screen do not need a mouse the screen is perfect size,Positive
1553,i am surprised there is a touchscreen review section because this has never worked on this laptop.,Positive
1554,"it was a wise choice, no complaints except that the screen can look a little dim in some bright room environments.",Positive
1555,it picks up finger prints more than your phone does and you can really see them too so make sure to wash your screen but besides that it is amazing!,Positive
1556,"keyboard, screen, interface all great.",Positive
1557,"great laptop for the $, outstanding screen, backlit keyboard [a must for me] i looked snd read many reviews till i found this laptop $316.00 us or [503$ cdn $ to my door], fast to, slim and light, alm. | 4 to 5 hrs in reality, and no touchscreen, [i think touchscreen is, stupid on a laptop anyway, ive never liked a laptp like this 1 in 20 years of using them, and the price is great, imo its untouchable at this pricepoint.",Positive
1558,"love backlit keyboard, screen is vivid!",Positive
1559,"fast processor , great retina display and great experience.",Positive
1560,the screen is beautiful.,Positive
1561,i was trying to upgrade this laptop for many purposes but when i upgraded ram the screen did not turn on.,Positive
1562,"the screen is beautiful and crisp, the webcam works great.",Positive
1563,i was never able to get the touchscreen/tablet mode to work but i did not look into it too much.,Negative
1564,"however, after charging it and turning it on for the first time, it not only showed the hone screen in all chinese, it continuously spoke a chinese word - over and over and over again.",Positive
1565,it boots up very fast and i like the touchscreen.,Positive
1566,"first of all, the screen is gorgeous!! | nice color and great resolution. | not many low to medium end laptops have 1920x1080 displays, it is really hard to find.",Positive
1567,my computer screen resolution sucks. |  you can see the dots around all items on the screen.,Negative
1568,i purchased this laptop a little over a year ago and the hinges snapped and the screen is starting to separate from the hinges.,Negative
1569,"here is my quick tutorial: 1) restart computer, 2) when screen goes blank start spamming f2 button including during acer logo screen and the bios interface will load, 3) use right arrow to get to next page pf bios and look for ""keyboard light timeout"" which will be set to ""enabled"", 4) use down arrow to highlight that line and f6 to change it, then f10 to save and exit and confirm with ""enter"" key.",Positive
1570,the screen is very sharp and it is wonderful for gaming.,Positive
1571,"some people have complained about the screen brightness, but at least for me, it is not at all an issue.",Negative
1572,"the screen quality is high and good but i do not think i can compare the high-class laptop but in general, it can give you a good experience at work.",Positive
1573,"very fast, screen is great.",Positive
1574,touchscreen is really good as well.,Positive
1575,"first of all, the screen is gorgeous!! | nice color and great resolution. | not many low to medium end laptops have 1920x1080 displays, it is really hard to find.",Positive
1576,screen has become pixelated.,Neutral
1577,"i just needed a basic laptop for work with a larger screen for spreadsheets; this one filled my bill nicely. | not a gamer, so cannot comment and the screen is not a touch device, so no ratings thereupon.",Positive
1578,black screen.,Negative
1579,the screen is responsive to the touch and very clear to read text and see video.,Positive
1580,"the screen is extremely nice, better than almost al; screens in this price point and nicer than some gaming laptops. | the screen size feels nice and large without being too big for most laptop bags.",Positive
1581,"if i had known how sensitive the track pad is when moving the cursor across the screen,i would not have purchased it.i went into the settings and put it at low sensitivity and that did not make any difference.that alone is a deal breaker.i will be selling this laptop hopefully soon.it absolutely drives me crazy,becasue as your cursor goess from sise to side or up and down,it opens up pages,screens etc......there is nothing you can do about it,period.",Positive
1582,the screen stopped working 13 months after purchase. | otherwise not a bad purchase...except for the screen thing,Positive
1583,"i rate it 9/10 overall for upgradability and ease of doing so, performance plugged in, size, form factor, feel, quality of screen, and simplicity of design.",Neutral
1584,"i liked the size of the screen, is fast very fast, i used to work in a dell but drive me crazy how slow was.",Positive
1585,"after spending time 'adjusting' win 11 to something that resembled a screen layout i was used to in win 7, 8, and 10, i found win 11 would not install any of the third party programs i use, due to a win 11 security feature.",Positive
1586,"i have an higher end hp touchscreen, but it is slow as molasses.",Negative
1587,it is great during conference zoom video and computer screensharing is great with clarity.,Positive
1588,the screen is now black the computer is not functional.,Negative
1589,screen started shutting down spontaneously and randomly.,Negative
1590,the screen is sharp for streaming movies and videos in 1080p!,Negative
1591,"great performance, nice screen and amazingly fast!",Positive
1592,"the negatives being said, the resolution on this computer is very good.",Positive
1593,"the keys have a nice firm touch to them, beautiful screen, and the lit keyboard lived up to my expectation.",Positive
1594,"fast and clear, the touchscreen works very well and the battery life is better than expected.",Positive
1595,"super light, beautiful screen quality, fast, easy to use.",Positive
1596,screen dead after one month.,Negative
