,Display Sentences,Display Polarity
2822,"the screen is bright and crisp. | i use this little lightweight computer in all three modes, and i am very happy with the touchscreen in either tent mode or tablet mode.",Positive
2823,on the keyboard laptop position you can touch screen to access most things.,Positive
2824,"the screen is beautiful, keyboard is easy to use, battery lasts a good while, it is light , it is portable and it is quite thin.",Positive
2825,great performace with an amazing 144 hz screen.,Positive
2826,"it seems like acer really tried to keep this as compact as possible while keeping the 15.6"" screen.",Positive
2827,super quick boot time <10 sec to log in screen.,Positive
2828,i had another acer before and the screen quality on this model is a huge improvement.,Positive
2829,i thought it had touch screen and it does not.,Neutral
2830,"it is much cheaper than the new surface laptop and has a bigger display,.",Positive
2831,"of course the display could be better but for what you use it for 95% of the time, 1366 x 768 is more than adequate. | videos are sharp and clear, document display clearly and crisp and texts are sharp on the screen.",Positive
2832,screen is dim.,Positive
2833,"use around 3 months, everything good, touch screen work very well...highly recommended for gaming!",Positive
2834,"the screen is surprisingly high quality and the general specs are pretty impressive. | sure it is a lil plastic-y on the bottom and around the screen, but it is not a $1000 computer so no complaints.",Positive
2835,"looooong bettery life, vert fast, great screen, amazing keyboard and fantastic mac os",Positive
2836,i love that it has touchscreen and tablet functionality while also retaining most functionality of a standard laptop. | i have not experienced any sticking or miss strikes from the keys and the touchscreen has worked flawlessly.,Positive
2837,"this product stays charged, but at random times, the screen will go blank and shuts down and will not turn back on.",Negative
2838,i love the screen size.,Positive
2839,i did not purchase for gaming and it is not a touch screen,Neutral
2840,"there is standard laptop mode, and then if you flip the display around completely, then you get the touchscreen tablet mode. | the laptop does recognize when you are using it in tablet mode and it brings up the onscreen keyboard. | the laptop display is 14"", and that is a good size for a tablet scree and mobility. | the display is glossy and vibrant with a small bezel.",Positive
2841,very cost efficient works well yet plastic cover/top around screen is very very thin plastic and cracked and split leaving me scared the screen might get damaged.,Negative
2842,"i walked away for about 10 minute, when i got back the screen was black, the power light showed it was on. | they other thing that was not great about it is the screen is very full, which makes it hard to see at times.",Negative
2843,"the screen went black and the keyboard felt very hot. | i am having issues with my other lenovo laptop, the screen just blacks out. | i understand it may be the touch screen.",Negative
2844,it is not touch screen but other then that decent and fast,Positive
2845,the screen flickers like an old tube tv attempting to get a station. | got a letter back to say they could not replicate the issue but replaced the screen.,Positive
2846,great laptop but the hinges decided to break on the right side right where the screen folds down.,Positive
2847,1080 ips screen low brightness.,Neutral
2848,"it is very quick and responsive, easy to personalize, the screen is huge, it is slim, and the keyboard has so many functions it makes me squeal a little bit.",Positive
2849,"great screen, good sound, very fast response, at a great price.",Positive
2850,the screen resolution and viewing angles are amazing on this device.,Positive
2851,frame rates have been good and the screen is very nice.,Positive
2852,the screen is flawless and sharp which is pleasant to look at when watching youtube videos.,Positive
2853,the screen was broken when i got it in the mail. | and wanted to charge me 280 dollars to replace the screen of a 300 dollar laptop...not at all pleased.,Positive
2854,"i love the backlit keyboard, as well as the ips display.",Positive
2855,the screen colors are very close to what phones have.,Positive
2856,it is replacing a 5 year old chromebook (that still works) but i wanted a touch screen.,Positive
2857,screen and sound is great.,Positive
2858,i like screen size...shoot!,Neutral
2859,the screen size is perfect.,Positive
2860,"this is almost identical in looks, although larger screen size and much better battery life as well as a faster processor make it a really good upgrade that should last for a good while. | love the touchscreen and the tablet mode.",Positive
2861,lots of complaints on this but i have had no luck finding a resolution.,Neutral
2862,"my main cons are the screen is kind of dim, also the speakers are not great.",Positive
2863,the screen quality is superb with the oled screen!,Positive
2864,this touchscreen laptop was not touchscreen.,Neutral
2865,"it is very fast, the screen is fantastic. | i am not a big fan of touchscreens, so do not use it much.",Positive
2866,battery lasts for days and the touch screen is really nice to.,Positive
2867,love the touch screen as well.,Positive
2868,it is good but very little memory and the screen resolution is poor,Positive
2869,the machine is great looking and the screen is very nice.,Positive
2870,"screen stays black, fan turns on, backlit keypad cycles through rgbs.",Negative
2871,got the dreaded black screen after 1 mos. | google acer or chrome book black screen.,Negative
2872,"perfect for students, has long battery life, great display quality and can run almost every student level software",Positive
2873,the screen had a sharp image. | i had the computer running a total of about 1 1/2 hours when it put up a blue screen and froze!,Negative
2874,"battery life is great, touch screen is awesome.",Positive
2875,"i like the touchscreen option. | first it does not support screen savers. | yes it ""sleeps"" and screen turns black, but i am more of an ambience type of person.",Positive
2876,"as soon as i opened it up and powered it on, i discovered a broken screen. | there was a large red line that ran up and down on the right portion of the screen and a chip in the bottom portion of the screen.",Negative
2877,not giving 5 stars because the hinge broke (detached from the display frame) after about 6 months of use.,Neutral
2878,the touch screen is nice but i should have researched other brands .,Positive
2879,red looks orange on my screen. | i have tried to capture what i see on my samsung desktop screen (pic 1) and what i see on my acer aspire 5 slim laptop screen (pic 2) of the very same web page and red color hex #ff0000.,Neutral
2880,"screen looks great, runs very smoothly.",Positive
2881,"finally, i just opened my laptop, which is in a hard plastic case, to find that the screen was broken internally and completely ruined.",Negative
2882,no touch screen so im not sure why it asks for stars on that. | i have to push the screen back at an angle to make it slightly better.,Neutral
2883,the screen ribbon area takes up 1 1/2 inches of space in 2 segments of 3/4 inch each. | while that in itself seems too large for screen size i call for assistance on illegible fonts.,Positive
2884,"great screen with a 144 hz which is a huge improvement coming from a 60 hz and personally, the rbg keyboard brings a smoothing finishing touch.",Positive
2885,not a touch screen.,Neutral
2886,screen is excellent in size and display.,Positive
2887,i put a second ssd into i had lying around and a second stick of ram for a total of 8 gigs this display is easily the best part of this machine.,Positive
2888,"it boots very quickly, has a responsive touch screen, and is.",Positive
2889,"she loves the sleek white color, long battery life, the graphics, speed and responsive touch screen.",Negative
2890,first of all; there is not touchscreen!,Positive
2891,the screen is flawless and sharp which is pleasant to look at when watching youtube videos.,Positive
2892,"out of the box, i powered it up and it asked for a pin with someone is name displayed at the start up.",Neutral
2893,the keyboard and ips screen are excellent.,Positive
2894,it runs these programs well unless you try screen recording at the same time.,Neutral
2895,"it runs well, i like the backlit keyboard, he has been able to have multiple tabs open with it not being slow, the screen size and quality is good, and it just looks nice in general.",Positive
2896,i like the screen quality.,Neutral
2897,"i wish that it was touch screen but not offered as such. | the screen is a nice size, clear and good quality.",Positive
2898,"not a touch screen, was disappointed with that.",Negative
2899,"i do not do gaming or have the touch screen, but for what i need it for, it works great.",Positive
2900,"nice big screen, comes with office 365 built in already, windows 10, and just very sleek features.",Positive
2901,"update om this laptop i bought it in may 19 2020 the keys are sticking an now the touch pads has stopped working the screen flickers ,this has turned out to be worthless ,these are not cheap ,so save your money",Negative
2902,on the first acer the screen went out completely(the filament) just 2 days after the 1 yr. warranty. | i would not have bought the second one if the screen had gone out a couple of months sooner.,Positive
2903,the screen is dull and not too bright.,Positive
2904,product is displayed as windows 10 but was sent to me with windows 7.,Neutral
2905,the touchscreen is awesome!,Positive
2906,"full hd ips screen, backlit keyboard, aluminum cover.",Positive
2907,monitor/screen overheated and melted.,Neutral
2908,"this model was appealing because (1) it has a 1080p display, and most cheap laptops still have 768 line displays; and (2) it uses a decent ryzen cpu, which is pretty fast and low-power compared to some celeron cpus you still see out there.",Positive
2909,"the quality of the screen, keyboard is great.",Positive
2910,however i was very impressed with the screen resolution and speed of the laptop.,Positive
2911,the screen quality is amazing.,Positive
2912,we done a lot of research on this particular model and read a lot of reviews and watched videos to make sure we were getting our money's worth and we are very satisfied the screen is big and super clear also easy to navigate.. thank you.,Positive
2913,"love the lightweight, clean design, and great screen.",Positive
2914,although the screen is not my favorite it still works well.,Positive
2915,screen is below average and so is the trackpad.,Negative
2916,let me start off the apple ecosystem is great but what really disappointed me after 2 months of use the screen starting getting bright spots along the bottom and left side and eventually turned into a mess of different colors rendering that part useless. | i got a quote from apple for 755 dollars to fix the screen including parts and labor and a 2 month wait time.,Positive
2917,i searched touch screen computers and this popped up.. this is no touch screen laptop so disappointed,Negative
2918,it is fast and has a decent sized screen with great quality.,Positive
2919,"after less than 4 months of owning this computer, the screen goes black if it is opened to or beyond a completely vertical position. | i am able to get the screen to turn on if i press on the computer near the hinge, but once i let go the screen goes black again. | the hinge itself is fine so my suspicion is that it has something to do with the ribbon cable that connects to the screen.",Positive
2920,"at approximately six weeks into use, the screen went totally blank while the motherboard still lit up. | the folks at the geek squad were able to boot up the computer to an external screen, indicating the screen on the laptop was defective.",Positive
2921,i love that it has a backlit keyboard (the keys have a smooth feel) and the screen flexes all the way back.,Positive
2922,"screen is sharp, very bright and responsive.",Positive
2923,"this ssd laptop is fast, light and has a bright, sharp screen.",Positive
2924,only wish it was touch screen for windows 10 functions,Neutral
2925,screen does not open and cursor does not work.,Neutral
2926,after 8 months the screen went black. | there was not a scratch on the screen.,Negative
2927,nice screen and seems to be reliable so far.,Positive
2928,after a while the screen goes completely black. | after another few minutes it again went into a black screen.,Negative
2929,"the only drawbacks as some people would say is there is no usb-c and the screen even though it is hd 1080p that the colors are not super accurate of course that is graphics and video people looking for precision color gamut accuracy but seriously most peoples eyes are not perfect either enough to see a difference, you look at this screen it is precision nice and crisp.",Positive
2930,lightweight with amazing screen and speakers.,Positive
2931,then every time she tries to use it she gets a screen that only shows chrome logo i have called a amazing customer support and they tried various troubleshooting and was advised our computer is defective.,Positive
2932,screen is not bright enough even at highest setting also speakers are to weak and not laud enough.,Negative
2933,"i have to admit, that i am not a touchscreen-user though.",Neutral
2934,very nice screen hd1080.,Positive
2935,"i thought wow what a steal for the price, a 1tb ssd, a 17 inch screen?",Positive
2936,screen is quite large and lighted keys upon touch is nice when using in poor lighting.,Positive
2937,"secondly, the hinges on the laptop screen are fragile and could snap which can damage the laptop's monitor. | lightly lifting the corner of the laptop can cause the screen to crack which will make this laptop useless.",Negative
2938,"great lightweight piece, decent screen.",Positive
2939,i received my new laptop with a line running vertically down the screen.,Negative
2940,if the hinge breaks and it breaks the screen they do not warranty it because it is a broken hinge that causes damage not hardware,Negative
2941,"i ordered a asus vivobook 15 thin and light laptop, 15.6"" fhd display.",Neutral
2942,very nice screen hd1080.,Positive
2943,i can still remember the look on her face when she found out it was not only touchscreen but could also fold and be used as a tablet!,Neutral
2944,"a complete waste of money, bad resolution, very slow processing.",Negative
2945,"i needed a new laptop as i have not bought a decent one since 2000. one teeny tiny screened netbook and one borrowed laptop that does not hold a charge in between really made me feel the lack. | i enjoy the portability of this unit, the keyboard feels nice and the screen size is perfect for casual usage.",Positive
2946,"despite the false advertising about this expensive little hobbit netbook, it has no touchscreen and does not fold... its 200$, the screen is 11 inches lol, this trackpad is awful and of course its just a chromebook, but still with 200 bucks your half way to building a brand new desktop pc that can play real games and has a a keyboard not made for 9 year olds.",Negative
2947,the first one self-destructed after the screen encasement decided to come apart after two years of use.,Positive
2948,it is touch screen and very attractive but it is the slowest computer i have ever come across in my life!,Positive
2949,i only use my laptop for school and it is so slow.i received laptop and the bezels were very shaky.now there are visual glitches all over the screen.,Positive
2950,i get a blue screen with error messages.,Neutral
2951,screen clear and well defined.,Positive
2952,the screen is super sharp and picture quality is unbelievable.,Negative
2953,now after the last update the screen freezes daily and i get a blue spinning circle and a black screen.,Negative
2954,update: 6months into having this laptop the screen hinge cracked.,Neutral
2955,very good laptop :) my boyfriend doesnt leave it even for a sec.... he always plays he games and use this laptop till it dies :) very clear hd display keys are smooth,Positive
2956,"although everything looked beautiful (display in particular), after setup i was not able to run a quick or full scan in windows defender.",Positive
2957,on the first acer the screen went out completely(the filament) just 2 days after the 1 yr. warranty. | i would not have bought the second one if the screen had gone out a couple of months sooner.,Positive
2958,jus got it today...took my time getting to know it thoroughly so far no disappointment screen and performance is absolutely great,Positive
2959,also this review just asked me to rate the touch screen... is this supposed to be touch screen?,Neutral
2960,"on paper it has all i need - 144hz screen, slim build for travel and 3050ti graphics.",Neutral
2961,the fhd display of this laptop is absolutely good.,Positive
2962,"in less than a year, the screen gave the dreaded black screen of death. | now i am on the hook for a new replacement screen.",Negative
2963,the other reviewers were right the screen is awesome.,Positive
2964,"they are purposefully misleading customers this is a production model that is advertised as having 300hz screen with 1440p and 16 gb of ddr5 ram but it is really 1080p 300hz the system is supposed to be 1440p display at 300 hz and 32gb of ddr5...do not buy this unless its price is reduced by $300 atleast....this is false advertising to give a 1080p pal 300hz display while caling it 1440p 300hz, ""just bad buisness""...",Negative
2965,"for this price having a 15.6"" ips screen with a small bezel surface and backlit keyboard is unheard of.",Negative
2966,"i was looking for something under 400 for years but never made a purchase because i have my own requirements: good speed, full hd (1080p), ips screen, backlit keyboard, and light weight.",Positive
2967,i just wish it could be used as a touch screen without the keys sticking out.,Neutral
2968,"it have very slim frame in screen, great material, full powerfull to do many task and enough storage to use windows.",Positive
2969,the screen stayed black. | i open the laptop all the way at 180 degrees and the screen would come on if i kept tapping it.,Negative
2970,got the dreaded black screen after 1 mos. | google acer or chrome book black screen.,Negative
2971,the screen is a great size.,Positive
2972,"love it, nice screen, good features and accessibility, perfect for my needs.",Positive
2973,"wide screen not heavy, the quality is good for the price!",Positive
2974,"i love the sleekness of it, just wish it was a touchscreen.",Positive
2975,screen stayed black.,Negative
2976,the macbookair does not have a touch screen and i do not use it for gaming.,Neutral
2977,"it was amazing until about 2 months in, it stopped turning on (the screen flashing the start up logo for half a second and turning back off.",Positive
2978,"when i purchased this laptop, i searched for laptop touch screen and this one came up, when i got it. | it was not touch screen",Neutral
2979,"they replaced the internals mobo/gpu, screen, keyboard, & os.",Neutral
2980,"low-end machine but screen is good, ports are good, it is nice and sleek enough for the price.",Positive
2981,"after 3 months it boots up and the light at the keyboards lights up, but the screen is just black.",Positive
2982,the touchscreen looks nice and the computer is still as fast as can be.,Positive
2983,"all of a sudden, the screen went black, but the power light and backlit keyboard stayed on.",Positive
2984,"it features a very nice crisp ips 1080p screen, has a slightly glossy screen, full size keyboard, is lightweight, thin, and fast --- and comes with a backlit keyboard.",Positive
2985,no this is not touchscreen which i was not really looking for anyway.,Negative
2986,"after a month of using this laptop and was initially satisfied, i received the blue screen of death.",Positive
2987,"great price, fast laptop, great screen quality.",Positive
2988,now the black screen comes up.,Negative
2989,there is no option to get past this screen.,Negative
2990,the screen stopped working 13 months after purchase. | otherwise not a bad purchase...except for the screen thing,Positive
2991,also the touchscreen is a joke.,Neutral
2992,the display only looks good from one very particular angle.,Positive
2993,i could not type anything - so i tried to use a on-screen keyboard. | then the touchscreen would not work.,Neutral
2994,screen went out in less than a week!,Negative
2995,"several months ago, however, the device ignored my instructions not update windows 10, auto-updated in the middle of the night, and has been unable to make it past the startup screen ever since.",Negative
2996,"big screen was a plus , but after some time my network connection started dropping every 5 mins.",Neutral
2997,"too much price than other laptops, the screen quality is not better, customer service is worst in the market",Negative
2998,"it runs well, i like the backlit keyboard, he has been able to have multiple tabs open with it not being slow, the screen size and quality is good, and it just looks nice in general.",Positive
2999,"third, after setting it up, and restarting it, the message on the screen said the computer was trying to repair itself, which it then said it could not do.",Neutral
3000,the ips panel is way better than the average laptop screen in this price range.,Positive
3001,i was looking for a simple laptop with a nice sized screen that i can work-from-home with and play games on as well.,Positive
3002,"very quiet speakers, relatively dim screen, bad web cam, ""meh"" track pad, not great for gaming unless you are playing something that is not very taxing on a computer.",Negative
3003,worked fine until i got a black screen that i could only get away with a hard reset.,Negative
3004,the new one i got i had for about 4/5 months now works perfect really nice screen resolution love the light up keyboard speakers work nice just keep it in safe mode if you want to do other stuff jus get a desktop top yk but if you are looking at a laptop go for this one trust me,Positive
3005,"this is a great starter laptop and works perfectly for my intended uses, only thing in the rating os there is no touch screen so i am not sure why it asks about one.",Positive
3006,"you would need a physical green screen in order for any virtual background on a zoom call, for instance.",Negative
3007,touch screen very responsive.,Positive
3008,had a blue line down the center of the screen,Negative
3009,"i really enjoy the security, the ease of use, and the touchscreen.",Positive
3010,very quick and responsive touch screen and keyboard.,Positive
3011,"very quiet speakers, relatively dim screen, bad web cam, ""meh"" track pad, not great for gaming unless you are playing something that is not very taxing on a computer.",Negative
3012,"the ips screen looks great, the keyboard lights up in different patterns, the battery life is ok, not great, but considering it is a gaming laptop, it does fine.",Positive
3013,i saw a review that claimed the screen was not crisp and clear but i think it is fine.,Positive
3014,"short load times, great graphic settings supported, annnnd the screen is huge.",Positive
3015,"the speaker is sufficiently loud, and the hi-rez screen is eye-popping.",Positive
3016,"i like that the screen is a touch screen and the device can function from a variety of angles (as a tablet, tripod, or conventional laptop). | the screen feels clearer and more vivid than my previous chromebook. | tip: push the lock button in the upper right corner if your screen shuts down from inactivity; it should turn right back on.",Positive
3017,"i have had this for a little over a month and so cannot return it to amazon, but it is already broken (screen display issue probably) and have to arrange to pack it up and mail it to acer to be fixed.",Negative
3018,"the screen is nice, ssd is super fast and the laptop is very responsive.",Positive
3019,this is making plenty of noise like it wants to turn on but display but never gets past that point.,Negative
3020,would love a touch screen or atleast the screen to be edge to edge and without the thick black edges.,Positive
3021,worked for about 3 months then the screen would go in and out and it quit working,Neutral
3022,the touch screen was always freezing up. | the touch screen does not respond the keyboard does not respond i cannot even turn it off i have to wait for the battery to run out.,Neutral
3023,the screen quality is fair.,Positive
3024,"this laptop is great all around, it charges fast, screen brightness is great, speed, battery life, and portability.",Positive
3025,"needed large screen, screen is excellent.",Positive
3026,the screen does have a minor bit of bleed-through on the top near the camera but once the screen is displaying anything but flat-black you do not notice it.,Positive
3027,"great overall laptop, powerful chip,nice screen, but not that bright (will be enough for indoor usage) battery is ok` will be enough for 2-3 movies pretty good build quality, great keyboard.",Positive
3028,the screen has good viewing angles.,Positive
3029,product is displayed as windows 10 but was sent to me with windows 7.,Neutral
3030,"great video/audio quality, easy keyboard and convenient touch screen.",Positive
3031,"my problem is that a 2"" crack has recently appeared in the case top (behind the screen) and it is just out of warranty: 1 year + 1 month old.",Positive
3032,"i love the backlit keyboard, large screen and i have yet to have issues with downloads , watching videos or even playing a game of solitaire.",Positive
3033,the display has a great refresh rate & good viewing angles.,Positive
3034,now the joint that flips up the screen is separating and i am sure will eventualy break.,Positive
