,Performance Sentences,Performance Polarity
0,i would do ok for things that are not gpu intensive. | they underclocked the gpu so you do not get the full power out of it but i caught it on sale and it was the cheapest laptop that fit my specs.,Positive
1,"if you want to stream or use programs, like google chrome, you need to switch from s mode to home mode.",Neutral
2,this laptop comes with built-in ram (4 gigs) and a 128 gigs of nvme ssd but you can upgrade it.,Neutral
3,"this laptop flies at every basic day to day task even in dual screens, i play some games like fortnite, minecraft dungeons and halo master chief collection as well as some games on xbox game pass as i have an xbox, i have used photoshop 3 layers max, illustrator 3 layers max and primere pro for basic stuff and it runs 1 adobe program smooth with 8gb ram or 3-4 with 16gb of ram at a time depending on how much ram you have installed, but it can be upgraded to 32gb ram max to do more especially with layers in adobe. | when considering this laptop i recommend purchasing additional 4gb ram to make it an 8gb system as the gpu takes 2gb and leaves you with 2gb for the entire system, with 16gb you really only have 14gb ram. | i have been using this laptop since may 2020 which i upgraded it to 16gb ram from 8gb which i did when i purchase it and 1tb ssd and to this day i have yet to have a problem. | take it out of s mode which i did from day one and the screen is very clear and better on my external monitor, keyboard is amazing in the dark as its backlit and the mouse pad is great...it really beats the i5 8th gen because the gpu is better especially in games where fortnite and halo would skip frames.......overall for a budget i give it 4.5",Positive
4,"obviously it is not a high powered gaming rig so do not expect speed or anything, but for basic tasks like running office programs and maybe organizing files it is sufficient, if a little slow. | so, if you are looking for a small portable netbook that can run microsoft office programs and do basic things, this is not a bad choice for the price, just be ready to work near an outlet.",Negative
5,how is a 2060 nvidia give me 100 more frames then a 3060????,Positive
6,"keyboard lights up, programs load quickly, and while it is not a chromebook (crapbook if you ask me), it is light weight!",Positive
7,the windows installation is unstable and crashes non-microsoft programs regularly.,Neutral
8,i bought this computer bought 8 gb of ram upgraded it to 12 gb of ram and am extremely happy with my computer runs hulu spotify 5 tabs of internet explorer and a couple other games just fine all at the same time,Positive
9,"the ssd is super fast to boot and navigate windows, there is not a lot of bloat ware, anddddd you can upgrade the ram and install another hard drive! | i am amazed how cheap and good this is, another 500$ on a gaming laptop simply gets you more frames per second, and hardly seems worth it unless u are a true gamer.",Positive
10,"went with the base model m1, 256 gig hd, and 8gb ram.",Negative
11,this laptop can also be upgraded with additional ram and ssd drive.,Neutral
12,i gave it 4 stars because it does not have too much ram and the screen quality is not like amazing but that is expected for the price. | ram and ssd both can be upgraded which is what i probably like the most as well.,Positive
13,battery life is dramatically longer than my last and the charge does not take that long either. | the ram is small but was easily upgraded from the back.,Positive
14,"2070 rtx graphics, 10th gen i-7 for $1399 (the price i bought it at currently) is damn solid.",Neutral
15,will comment down the road as to everyday use & performance......,Negative
16,the majority of the time my fps was well over 100. i say this because the 3070 inside this is not a full power desktop style gpu(as stated in the product information above).,Negative
17,"it boots in under 10 seconds and is extremely responsive for basic tasks with just the 4gb ram. | it is worth the extra $35 to just get a 16gb ram kit (do not mix and match unless you are very experienced or it might actually slow your computer down - do not go buy an 8gb stick and throw it in. | there are numerous videos on youtube showing how to install the ram - it is very easy and can be done by anyone. | once done, you have got a very good pc for under $400 instead of paying twice that much for similar performance.",Positive
18,time to choose another brand for the combination of cpu and video.,Neutral
19,"runs most of my games on medium at 200+ frames, never had a game play under 80 frames unless i intentionally set the framers lower for environmental heat reasons (i play outside allot and it is hot lately).",Positive
20,"the vega graphics are awesome a specially only being clocked at 1100 megahertz, so playing anything moderate is great.",Positive
21,"the performance is amazing, the screen displays great, it is lightweight, and the battery lasts for like 12 hours of continuous use.",Positive
22,"works well in starcraft and i have not upgraded ram yet , so ya nice",Positive
23,i have a lenovo core i7 with 16 gb of ram and this acer is faster.,Neutral
24,can handle most standard tasks and programs with ease.,Positive
25,"i bought this laptop in december 2020. i was actually debating myself between this one or a similar windows computer, i almost went for the windows because the processor of the macbook air 2019 was not good enough (intel core i3), but i decided to wait and two weeks later this one was launched. | it is way superior than any intel core processor, i just love it.",Positive
26,"processors, ram, gpu's, display, screen size, etc., so many things to consider.",Positive
27,i am amazed with the performance screen quality.,Neutral
28,throw some extra ram in there and it works great!,Positive
29,"the laptop is equipped with 4gb of ram and windows 10 s mode. | it worked fine, but i upgraded it with an additional 8gb of ram and converted it to regular windows 10.",Positive
30,"i like it and all but micro soft is not programmed on here, and it is not a freaking touching screen as they say it is.",Positive
31,advertised cpu speed is 3.5 ghz and realistic speed is 2.10 ghz.,Positive
32,so far i have played most of the top titles (to include half life alyx) on high to ultra graphics with no issues. | i would highly recommend it to anyone looking to future proof their gaming prospects without spending an outrageous amount for the laptops with the rtx 2080 graphics cards.,Negative
33,"everything is super snappy and have had no performance issues after a week of putting it through the paces. | the keys are, however, a little cramped, and it takes a lot of getting used to.",Positive
34,"as a gamer it runs very well, anyone who knows how to utilize the ram will find this more than covers most games.",Positive
35,"like other reviews have said, this is not (exactly) a budget laptop and the ryzen in this laptop packs a punch especially if you upgrade the ram (i got the 4gb version).",Negative
36,"two issues with my 2020 apple macbook pro with apple m1 chip (13-inch, 8gb ram, 256gb ssd storage): 1) debris can fall into the seam between the keyboard and screen unseen and 2) i kept having to adjust the brightness; even though i set the screen to be bright, it kept returning to dim.",Positive
37,"this laptop flies at every basic day to day task even in dual screens, i play some games like fortnite, minecraft dungeons and halo master chief collection as well as some games on xbox game pass as i have an xbox, i have used photoshop 3 layers max, illustrator 3 layers max and primere pro for basic stuff and it runs 1 adobe program smooth with 8gb ram or 3-4 with 16gb of ram at a time depending on how much ram you have installed, but it can be upgraded to 32gb ram max to do more especially with layers in adobe. | when considering this laptop i recommend purchasing additional 4gb ram to make it an 8gb system as the gpu takes 2gb and leaves you with 2gb for the entire system, with 16gb you really only have 14gb ram. | i have been using this laptop since may 2020 which i upgraded it to 16gb ram from 8gb which i did when i purchase it and 1tb ssd and to this day i have yet to have a problem. | take it out of s mode which i did from day one and the screen is very clear and better on my external monitor, keyboard is amazing in the dark as its backlit and the mouse pad is great...it really beats the i5 8th gen because the gpu is better especially in games where fortnite and halo would skip frames.......overall for a budget i give it 4.5",Positive
38,i would like a refund for half the price given the product only has half the memory and 8gb of ram.,Negative
39,"i love it, perfect starter computer and i recommend to add more ram for better use",Positive
40,"it has a really nice graphics card and it shows, as well as fast speed loading from page to page for everyday use or in game grinding. | with the processor and graphics card given, this is an amazing laptop for the price.",Positive
41,"performance so far has been great, long battery life, excellent screen clarity and very good speed for what they are using it for.",Positive
42,"games like blankos block party, decentraland, and the sandbox would not work on my old dell because of the outdated graphics.",Negative
43,"came with a good amount of bloatware, but nothing that going through the programs and uninstalling what you do not want will not resolve.",Positive
44,"the graphics card is above or equivalent next gen, as the next gen video card is the 2070ti.",Neutral
45,add more ram and second hard drive and take it out of windows 10 s mode.,Positive
46,this is my first chromebook and i am very pleased with its performance and recommend it to anyone looking for a chromebook.at a great price.,Positive
47,apps and other programs do not lag and fire up quickly.,Positive
48,the gpu is horrible and causes video to lag any time it starts getting a little warm.,Negative
49,"the laptop itself is amazing for what it was bought for to play newer titles at higher frames, it does so on ultra high settings running with vsync at the monitors good 144hz monitor, screen quality is great and the 144hz makes it that much better. | if you want a good laptop for the right price with per key rgb with an rtx card and a newer processer this is for you, and ram can be upgraded as well as storage.",Positive
50,(it plays the older ones fine but lacks the ram to do anything that is very demamding.),Positive
51,"the battery performance during gaming is not great, but 144hz refresh rate and power consumption of the video card during gaming does whittle the battery performance down fairly quickly. | however when used for school and maxed out for battery performance, to include restricting to a 60hz refresh rate, the system easily lasts and entire day at school for my son without needing to be plugged in to recharge.",Positive
52,only had minor issues with browsers running but deleted and redownloaded program to fix it.,Negative
53,overall though i would highly recommend this for performance and the $ value.,Positive
54,"pro: fast processor, light weight, great screen, and no challenges.",Positive
55,"that said, tech heads like me have a thing for diamonds in the rough and seeing what kind of performance we can squeeze out of a machine. | the rest is probably going to be unacceptable to anyone looking for a decent level of performance to do...well mostly anything. | the only way you are really going to open up the possibilities for this laptop is to, as other reviews suggest, get out of windows s mode, and invest in adding more ram and installing a second 2.5"" ssd. | i ended up spending an additional $120 for 2 sticks of 8 gb ram and a 1tb ssd so my total cost (after black friday deal) was just under $380. | you can even play games on this thing--provided you install the dedicated graphics drivers from amd (called adrenaline). | if you want a backup laptop for travelling, and are willing to put in a bit more money and time into getting the performance up to speed (literally), then this is probably best laptop value on amazon right now.",Positive
56,i have got most of my settings turned up and i am getting 100-120 frames.,Positive
57,"the track pad is waaay to the left.. maybe perfect for a leftie, but if you are like me, you like feel like you have to shift/cramp to use it.",Positive
58,i chose to add an additional 4gb of ram and a 2.5” ssd. | ram and ssd installation were extremely easy.,Positive
59,"pretty much a very good gaming laptop right out of the box, it comes with 2 stick of 8 gb ram, so did not even need to update the memory there.",Positive
60,"but the plastic frame is super flimsy and easily broken, particularly around the power cable connection.",Positive
61,"purchased 8gb of ram along with this laptop. | cpu is slower than intel i5 processor, but fast enough for basic use.",Positive
62,"hp diagnostic program is a joke. | 1 month into my 2 year protection program, but not worth time or energy to send back.",Negative
63,only drawback is the fixed 8gb ram complement.,Positive
64,"phenomenal laptop, amazing experience, great for gaming (keep in mind the gpu has 4gb vram), affordable, would highly recommend it.",Positive
65,"this is a very good budget laptop, with an amd (not intel) processor. | it has a solid state drive and an empty ram slot and even an extra, empty sata hard drive slot. | if you do not want to open the laptop to upgrade at all, just note the single 4gb of ram is fine for web browsing and running lightweight programs and some older games. | if you put in an extra ram stick, plus a 7mm thick sata type hard drive, then you have a very cheap and decent multimedia laptop that can do tasks a bit faster than the stock configuration.",Positive
66,i added 16 mb ram.,Neutral
67,easy to upgrade ram and hdd.,Positive
68,"before turning it on, i installed 4 gb of additional ram, for a total of 8gb ram, and i installed a 240gb ssd. | with the additional ram, i now have 6gb of usable ram, and it seems to function smoothly. | so i spent 18 for ram, 25 for ssd. | fan noise is kind of loud but you just got to adjust your power settings and processor do not set it to max.",Positive
69,"as tested: ryzen 3 3200, 4gb ram (upgraded to 8gb), 128gb ssd (added 2tb hdd)",Neutral
70,the laptop is made to be upgraded which i did for the ram and ssd.,Neutral
71,unreal and unity projects load fast and able to run most my games on max settings (got kind of hot on warframe),Positive
72,"this laptop was purchased as a “toy” for my husband who has over 40 years experience building and tweaking computer systems, mainframe, slave units, desktops and “other stuff”, military and civilian applications.",Negative
73,the only change i made to the system was adding an 8 gb ram drive onto the already installed 4. it was simple to do and very cheap.,Positive
74,"i had to disable hairworks(not optimized) on certain games since it is not worth the extra processing power for sacrificed frames. | obviously when playing high demanding games, the fan ramped but not enough to annoy me.",Positive
75,the 4 gb ram & 64 gb ssd are great upgrades from original specs and make this unit such a tremendous value.,Positive
76,games and office programs loaded so slow.,Negative
77,"performance is fantastic, has no issues running aaa titles at the best settings.",Positive
78,"for the price, there was very few laptops that came close to its performance.",Negative
79,the c - unrated status with better business bureau indicates very poor performance as a seller. | this stopped my microsoft programs from working (i own several versions of ms office that worked fine in win10 and do not work in win11).,Positive
80,"after spending an additional 30 dollars for an extra 8 gigs of ram, this laptop is great. | without the ram upgrade this would be a 3/5. | but the ram upgrade is cheap and very easy, and 4 gb simply is not enough in today's day and age.",Positive
81,"the plastic frame around the screen buckled, bowed and unsnapped (it is a two pc plastic frame front and back a that snaps together around the screen, and may be glued together but not molded together.",Neutral
82,"this is the least expensive computer i have ever owned, and i am very pleased with its performance.",Negative
83,"bought this to replace the desktop i built in 2015, so far im impressed, i recommend ordering crucial ram 8gb ddr4 3200mhz cl22 with it, and a ssd as space is limited, i had a 256 gig sitting around that i popped inside it. | with the upgraded ram i have to say it runs most things i throw at it, games that area few years old run at a great frame rate, and more recent things like farcry 6 im getting about 40 - 55 frames, so a little subpar but definitely playable. | i bought a laptop for the portability not the graphics capability so im absolutely ok with it. | the one gripe i have is popping open the clamshell case to perform the ram upgrade and install the ssd was more difficult than i think it should be, it made me miss the days they left a little trapdoor port for easy access and upgrades.",Positive
84,this laptop is very good and i would highly recommend if you are looking for a budget laptop but one thing i do recommend is also buying a ram upgrade kit because 4 gigs can get eaten up very quickly so i recommend upgrading to either 8 or 16 gigs of ram.,Positive
85,if you had the option though i would spend the extra $500 for the better gpu. | ram and ssd can be upgraded later which is another nice spec.,Positive
86,if you upgrade the ram.,Neutral
87,the have a lot of performance in a slimline case.,Neutral
88,"it is a great size, good battery life, quick cpu, and and sit multiple ways.",Positive
89,"be aware that the gpu rtx 3050ti uses 40 watts of battery, which is a lot. | its performance has been remarkable and i suggest this laptop for students and people who want to do a little gaming.",Positive
90,"now i am not a heavy gamer, do not download a lot of programs, but do rely on the internet and have downloaded games like wordplay and solitaire.",Positive
91,"the computer lost it is program, and i cannot get it back. | when i could not get it back through the computer itself, i downloaded a window's recovery disk on a usb disk, and still can not get the program back.",Neutral
92,"need the benefits of a pc but for travel or your kids, this will do both, this is no performance pc, but will do pretty much any day to day home tasks and some games....great to watch movies also",Positive
93,i love how light the laptop is and that you can easily upgrade the ram and storage.,Positive
94,"there seems to be no camera at all, and even though it will play graphics intensive games, it always seems to freeze after an hour or two.",Neutral
95,can run any game at 144 fps or more (with minor graphics adjusting).,Positive
96,"the speed is incredible, the graphics quality is remarkable and its just an overall good laptop.",Positive
97,"after i opened it, it turns out that the processor is amd rayzon !!",Neutral
98,"the computer is overall good, no complaints for performance.",Positive
99,i spent 60 dollars more and bought 8 more gigs of ram and a 512 nvme hard drive and i could not be happier with the performance.,Positive
100,"i am not knowledgeable about windows at all, but this computer has amazing performance all packed in for a great price.",Positive
101,"i upgraded the ram myself to 8gb, which for this non savy tech guy was very simple.",Neutral
102,the processor makes this fast and it has impressive storage and graphics.,Positive
103,the computer is quick to boot and programs load quickly.,Positive
104,if you are a gamer or someone that intends to do some work on this laptop that demands serious cpu or gpu power then you better look elsewhere.,Positive
105,"from its ample connectivity to its speedy ram, this is one laptop that is well worth the price.",Positive
106,you can use word on it but it is a very primitive program and looks like word circa 1995.,Positive
107,should you need it for high intensity style games this will not give you the performance you are looking for.,Positive
108,"able to increase ram? | i added another 8gb ddr4 ram to make it 12gb. | now my laptop has more ram and disk space. | for gaming, the graphics card is not the best so i dont recommend it for serious gaming but for normal gaming with lesser loads it works like a charm.",Positive
109,"the cpu is good, better than some laptops in the same price bracket, and with enough ram to be a good experience. | the gpu just is not very good while everything else is quite good.",Positive
110,processor cannot handle too many tasks at the same time.,Positive
111,"for the price its great if your going to try and game like good quality high demand games it wont do so great but i didnt get it for gaming i got it for needing a computer on the go that i can move around and use for my drones gopro and car or whatever i needed cause lugging a gaming desktop around wasnt ideal and i have a very big and very heavy gaming laptop that i dont care to take around unless i plan on gaming on the go so this was a perfect cheap latop that would get anything basic i needed it for and i upgraded the ram to 32gb and put a 2.5"" ssd 1tb in it so i can upload my gopro footage and drone footage if i need to make room on the micro sd card and it works great the boot time is actually so fast its a little faster then my gaming desktop on a m.2. | great light weight laptop that has enough performance for me to browse multiple tabs at once and multiple programs running all at once with no problems and the 5g wifi is nice and fast i dont even use a ethernet, the price went up since i purchased it a year ago but its still cheap and works great i havent had any problems with it and putting in the ssd and upgraded ram was very easy and straight forward i dont use it everyday all day like some but so far its been doing its job",Positive
112,"it is no power house, and some applications drain the ram but it works just fine.",Positive
113,"i loved it, the performance was all good, i used it for gaming and adobe programs as a graphic designer.",Positive
114,it is very fast but i ordered it with additional ram.,Positive
115,"nice look, but the keyboard will jot let me change colors and i have tried going in the armoury but nothing… overall good performance while streaming and playing sims",Positive
116,"summary: my current desktop is an older dell xps 8920 from 2017, which has a i7-7700 processor.",Positive
117,"bought this unit for its price point and the fact that it has an open bay to add a 2.5"" ssd and an open slot for additional dram memory.",Neutral
118,"i bought this laptop for my son and he liked it very much, great performance and screen quality is top notch.",Positive
119,screen is nice and big so it also works really well to watch your favorite programs.,Positive
120,great computer with added ram.,Positive
121,little did i know that chromebooks are severely limited in their abilities to run programs and preform tasks.,Negative
122,"the laptop was great for a year i was loving it, great performance in gaming and overall great performance, but it was getting really hot will playing games, temp around 90-100 temp.",Positive
123,"boots fast, has a great screen and have not had any issues with performance.",Positive
124,"heat dissipation from the gpu goes through the w,a,s,d keys on the keyboard making for very uncomfortable gaming unless you use an external keyboard. | gpu started glitching after a week of use.",Negative
125,"i felt how light it was and i thought to myself, there is no way i can get performance out of this thing. | i upgraded the ssd to a 900gb and put another stick of ram in and i can run *wow* on high settings!",Positive
126,"my computer is very good, it has dual chanel for ram memory (expandible 32gb), and i can install other hard disk (hd o ssd), but your original ssd nvme is the speed low.",Positive
127,slow after a while and the drivers and cpu suck .,Negative
128,able to handle a couple programs at a time.,Positive
129,loads quickly and the cpu and gpu are good enough to stream videos on and do school work.,Positive
130,"the quad-core mediatek processor is fast, at least fast in terms of what a chromebook is.",Positive
131,"excellent laptop with high performance, and a beautiful 1080p display.",Positive
132,i still use a few programs that have disks and prefer local (not cloud) storage. | this thing has next to no ram/ storage and needs to be upgraded almost out of the box.,Negative
133,i added another stick of ram as 4gbs was not enough.,Neutral
134,"i ordered this on a one-day ""flash sale"", and i had the choice of intel or amd, nvidia, intel uhd or vega3 graphics.",Neutral
135,"if you need something faster, i would get the same computer but with an i5 processor for $200 more.",Positive
136,"the equipment is very good according to its price, it has 2 slots for ram memory, and 1 additional option to install a hard disk.",Positive
137,"despite low ram and hard drive, it is pretty fast while browsing and doing any kind of work on it. | also, you can always upgrade the ram and hard drive for few extra bucks and this laptop still will be cheap.",Positive
138,this can handle some gaming (added another 4gig stick of memory ) just dont expect high performance.,Positive
139,"high end cpu and gpu, high end performance, worth the money",Positive
140,"the battery life is incredible; one charge can last most of the day with basic usage, but of course it would require another charge if using ram intensive applications but overall i am happy with this upgrade. | the m1 processor is such a nice upgrade because processing time have improved because the work is done so much faster, and the 16gb of ram definitely is a nice combination.",Positive
