,Performance Sentences,Performance Polarity
2717,"i do recommend an upgrade for the ram though, i maxed out with web pages, at the time i only had about 7 open. | i upgraded to 16gb of ram. | as far as upgrading it, it took about 5mins and the 16gbs actually have it running a few degrees cooler and the cpu has not seen anything over 20% usage.",Negative
2718,"latest gen ryzen cpu, 4gb of ddr4 2666mhz ram (fast), and a 128gb nvme (fast) storage drive. | took the 4gb of ram and added another 8gb for a total of 12gb, and upgraded the ssd to a 512gb nvme drive.",Positive
2719,the cpu is soooooooo slow this thing under preformed for a ryzen 3 ,Negative
2720,the laptop is made to be upgraded which i did for the ram and ssd.,Neutral
2721,"i added 4gb of ram (search ""samsung 4gb ddr4 pc4-21300, 2666mhz, 260 pin sodimm, 1.2v, cl 19 laptop ram memory module"" here on amazon) and used a win7pro old license to upgrade to windows 10 pro. | this machine is a really good deal and a great value, if you do not expect top notch gaming performance out of it.",Positive
2722,"this is an op laptop, excellent for gaming almost any new game, playing fps games is really smooth with that 300hz screen, when working at top speed fans there are not as loud as i expected and you can easily control every aspect of performance, the mux switch is an excellent addition, the only con is that does not come with a camera but overall its a must have laptop if you are looking for better performance, with that 12gen intel chip things fly!",Positive
2723,although it comes with only 4gb of ram... laptop is easily upgradeable via removing back panel and adding more ram.,Positive
2724,i have an acer desk top with the windows 7 program and have never had any problems with it.,Positive
2725,"acer aspire 5 slim laptop, 15.6 inches full hd ips display, amd ryzen 3 3200u, vega 3 graphics, 4gb.",Positive
2726,ram comes with 4gb although is expandable.,Neutral
2727,if i held them crammed into my ear i could faintly hear.,Negative
2728,"despite a slower than normal processor it runs like an 8 core. | graphics are amazing, interface is amazing.",Positive
2729,great performance web surfing.,Positive
2730,"whole computer is really a tiny bit larger than a notebook, but the processor is fast and all.. i thought i was upgrading, but i have to wear glasses when using this thing to see the letters.",Positive
2731,"got this on black friday for $250, really solid built for this price, add a 4 gb of ram for dual-channel, and you are good to go.",Positive
2732,"was delivered way earlier than expected, great performance, pretty good value for the money, temps are decent though could be improved if you are willing to try hand at undervolting and/or re-pasting, pretty happy with what i have seen of it so far",Positive
2733,"this is a nice laptop for the price, and it is very easy to upgrade the ram and add a second hard drive. | i ended up installing a 7mm ssd and an additional 4gb of ram, and now it is blazing fast.",Positive
2734,"able to increase ram? | i added another 8gb ddr4 ram to make it 12gb. | now my laptop has more ram and disk space. | for gaming, the graphics card is not the best so i dont recommend it for serious gaming but for normal gaming with lesser loads it works like a charm.",Positive
2735,"i only use for browsing, streaming and a few games but the quality and performance is amazing for the low price.",Positive
2736,pretty fast for only 4gb of ram.,Positive
2737,"perfect keyboard, perfect weight, perfect battery life, perfect trackpad, perfect performance, perfect touch id, perfect feel, perfect build, perfect look, perfect size, perfect stereo sound, perfect screen, perfect noise absence as not having a fan!",Positive
2738,graphics are beautiful and the speed is great for a small laptop like this.,Positive
2739,he upgraded the ram to 32 gb and double storage capacity! | he uses the device now for his work which require bigger ram to process.,Neutral
2740,"screen's nice, form factor is decent and performance is good.",Positive
2741,"the amd ryzen3 processor is good enough for what i do. | (no gaming, just browsing and word processing) the ram can be upgraded to 32g and you can add a ssd hd for extra storage if you want very easily. | for the price it it would be hard to beat with features it has and the ease at which you can upgrade the ram and extra hd.",Positive
2742,"this laptop flies at every basic day to day task even in dual screens, i play some games like fortnite, minecraft dungeons and halo master chief collection as well as some games on xbox game pass as i have an xbox, i have used photoshop 3 layers max, illustrator 3 layers max and primere pro for basic stuff and it runs 1 adobe program smooth with 8gb ram or 3-4 with 16gb of ram at a time depending on how much ram you have installed, but it can be upgraded to 32gb ram max to do more especially with layers in adobe. | when considering this laptop i recommend purchasing additional 4gb ram to make it an 8gb system as the gpu takes 2gb and leaves you with 2gb for the entire system, with 16gb you really only have 14gb ram. | i have been using this laptop since may 2020 which i upgraded it to 16gb ram from 8gb which i did when i purchase it and 1tb ssd and to this day i have yet to have a problem. | take it out of s mode which i did from day one and the screen is very clear and better on my external monitor, keyboard is amazing in the dark as its backlit and the mouse pad is great...it really beats the i5 8th gen because the gpu is better especially in games where fortnite and halo would skip frames.......overall for a budget i give it 4.5",Positive
2743,"the laptop runs fine and games look great but there was something terribly terribly wrong with the graphics card. | i would have it idle, sitting at the desktop but the graphics card would be running on full blast and running the battery down in less than 2 hours.",Positive
2744,graphics are awesome.,Positive
2745,"the acer 5 slim is sleek, beautiful, durable, lightweight, lightning fast (when upgraded to 16gb of ram), and has a ridiculously low price tag. | for this reason, i knew the ram upgrade would be necessary. | this pc would likely be quite slow if you chose to keep the 4gb of ram, as 2gb is shared memory.",Positive
2746,"...added ram for 16gb, had a 500gb samsung pro evo from an old laptop and formatted in ext4.",Positive
2747,i order the gaming programs and have not been able to use it not sure why,Positive
2748,it is terrible handling pictures and graphics.,Negative
2749,"from my experience windows defender is the best antiviral program for a windows computer. | since its a windows computer it also comes with edge, another program i dislike.",Positive
2750,"this laptop is a awesome purchase... upgrade it with 16gb and installed an 1tb hdd, very smooth limited bloatware and it comes with 1 month of office 365.. you would have to install your own antivirus program (does not come with one) but this laptop fast with the upgrade... just a bit disappointed with the battery life, despite changing the settings it will still be 4 hours not ""7"" as claimed.",Positive
2751,"i was worried about the compatibility of the m1 processor but by now i can tell that at the moment all my stuff is running flawless on this mac: all office programs, ftp clients, compressors, vpn software, database clients, etc.",Positive
2752,"i do a lot of art and manage a few accounts, so being able to multitask so many programs at once is just what i needed.",Positive
2753,spent an extra $70 upgrading to 16gb ram.,Negative
2754,bought a 16 gb ram chip and put it in.,Neutral
2755,"finally an affordable laptop that is able to handle my work programs, not tied to a desk anymore.",Positive
2756,"from it is super responsive processor to it is excellent graphics, this laptop is everything the beginner gamer needs.",Positive
2757,i am almost certain that the legion is the best cost to performance ratio out there currently.,Positive
2758,i have already installed 3 gb worth of cc on my sims 4 and it still moves awesome and quickly and the graphics are amazing!!,Positive
2759,you can open back panel too to for upgrade ram and storage just need to unscrew 10 nuts and remove the panel slowly you ok. speed is ok too storage was kind of let down only 119 gb but i am good with that beside i can add extra storage so its good. | ram was kind of letdown too only 4gb but i replaced mine with 2 8gb sticks already ( that is 16gb in total) but with 4gb ran just fine .,Positive
2760,"the graphics are good, however i have not done any gaming.",Positive
2761,"aspire 5 with 4gb ram 128gb pcie nvme ssd drive notes (long, so you may want to skip this review):",Negative
2762,"this one has loud, but less annoying fans, and the gpu stays around 86 when playing modern warfare.",Negative
2763,excellent value and is quite fast with the $24 extra 4 gb of ram i added to it as well.,Positive
2764,"i love this laptop, is powerful enough, gives excellent graphics with amazing performance and love that most ports are in the back so they do not get in the way",Positive
2765,"i am not sure about gaming because i am not a gamer, but i suspect it does not have enough memory for graphics.",Negative
2766,he said it was not worth fixing and next laptop i buy should be an intel processor with a solid state hard drive.,Negative
2767,sturdy metal frame and vibrant screen.,Positive
2768,"i just took off the back and doubled my ram for $20. | i thought i would not need to add more ram but then i added a couple more programs and it was running at 80 to 90%, and other reviews talked about how easy it was to add another 4gb (so it now has 2 x 4gb installed). | here is the memory module i bought from amazon for $20 - samsung 4gb ddr4 pc4-21300, 2666mhz, 260 pin sodimm, 1.2v, cl 19 laptop ram memory module.",Positive
2769,after setting up and transferring all programs to this laptop i began to add the ssd.,Neutral
2770,"the downside to this is the ram is extremely small for such a high gpu. | after updating the ram i was able to run any and all games at the absolute highest settings while still keeping above 60fps. | all in and bought, i believe i spent around $1200 for the laptop, ram, ssd, and cooling mat.",Positive
2771,"i upped the ram to 8 and got shed of s mode, so it is plenty fast for my use ( love the ryzen ssd) also has a very good sound which is far better than average.",Positive
2772,i added a 1tb hdd and 4gb of ram and the laptop runs great.,Positive
2773,the laptop is really fast due to ssd m.2 drive and 8gb ddr4 ram.,Positive
2774,i plan on upgrading the ram because it seems pretty easy with a bit of youtube research.,Positive
2775,"acer chromebook 512 | intel celeron n4020 processor | 12"" hd+ display | intel uhd graphics 600 | 4gb lpddr4 | 32gb emmc | intel 9560 802.11ac gigabit wifi 5 | mil-std 810g | chrome os | cb512-c1kj",Neutral
2776,"like a lot of reviewers i upgraded the ram from 4 to 8gb and....it is twice as fast  but seriously, it is so much smoother and downloading files from my ipad to this does not take all day.",Positive
2777,took the hard drive and ram out so i can get it analyzed by a forensic expert to find out what happened.,Negative
2778,"it is not great for photo editing, rendering videos, or other processor-intensive tasks, though. | if you are looking to do some light gaming (very light) you can easily upgrade the ram and storage (they include a kit to add an ssd to the system, which is awesome). | i use it to run my laser cutter and it does fine now that i have bumped the ram up to 16gb.",Positive
2779,i am going to spend the 30 bucks and get more ram to make it just a little faster. | may overclock the hardrive if the ram does not get me as fast as i want it to go.,Positive
2780,do not really have any complaints except build quality but for the price they had to cut a corner somewhere and i would take performance over build quality anyday.,Negative
2781,update 20-9-2022 the hinge on the right side of the screen broke yesterday and now i cannot open the laptop without damaging the frame around the screen... all in all this was a total waste of money.,Positive
2782,"it does not allow programs not ""verified"" by microsoft.",Neutral
2783,the 16gb of ram is awesome!,Positive
2784,mine was not touch screen nor did it have enough ram/gb for gaming.,Neutral
2785,"the cpu fan is always on full blast, even when idling or having one browser tab open.",Positive
2786,"amazing cpu, ram, ssd, and ips screen meaning best value for your typical laptop usage.",Positive
2787,"the graphic card, cpu, and ram are good enough to play heavy game. | you can also can upgrade the ram.",Positive
2788,it is not its the 2021. has 11th gen cpu and no finger print reader.,Neutral
2789,a good product at good price and excellent amd cpu performance with the help of ssd.,Positive
2790,"for about the same price, lenovo legion 5 pro offers a better cpu and more tdp to the gpu 3070.",Positive
2791,"i do not use my mac for gaming, heavy downloads, large graphics so cannot comment but is why the air is a perfect choice over the pro.",Positive
2792,"after adding more ram & 2nd drive, the laptop performs super well.",Positive
2793,"i have only run into issues, stuttering in games, frame drops runs super hot, non existent battery life doesnt hit the frames it states while playing games.",Positive
2794,"this acer laptop pc has a good display, the backlit keyboard is a real plus and the machine delivers decent performance.",Positive
2795,"i do not know if it will satisfy business users if they require more internal storage and more powerful ram, but for me i am satisfied with this laptop and it is my first ever personal laptop i can only speak for my own experience.",Positive
2796,"finally, the processor performance is just fine for very basic tasks, forget about running heavy duty apps.",Positive
2797,if you can add a ram it will be perfect.,Positive
2798,the 85w max on the gpu which is listed at 130w is a pretty big lie and makes the 3070 a 3060 more or less.,Positive
2799,great performance web surfing.,Positive
2800,"the speakers are not loud and sound slightly tinny, but overall the laptop has a good hardware set and still ram and hdd upgradable.",Positive
2801,"i loved that its all amd, not a fan of intel, and to get this performance for this price is insane!",Negative
2802,"also love that you are able to upgrade the storage/ram yourself, a very nice touch.",Positive
2803,i did not have to adjust the quality of the graphics or anything.,Neutral
2804,bought this over two years ago and it still works consistently with no noticeable degradation in performance.,Positive
2805,"i got this on prime day for about $300 delivered and had a good feel for what i was buying, a bit disappointed with overall performance and battery. | first thing i did was upgrade ram with an 8gb stick for better performance then i tuned windows 11 for better performance with fewer visuals, turned battery charge stopping point to 80% for longer battery life. | also i installed avast av as i heard windows defender was causing performance issues - probably fixed by now",Positive
2806,"i do not need a lot of memory or performance, just a nice, reliable laptop that can handle average use. | i use web based programs, word, and excel.",Positive
2807,"sleek laptop, cpu bottleneck.",Neutral
2808,"this thing is great, does everything my laptop was doing without microsoft, no more freeze frame, slow startup ect.",Positive
2809,"those reviews complaining of fan noise are ridiculous, what do you expect with a performance laptop, it needs to cool.",Positive
2810,"this thing is on par with my tower benchmark-wise; its gpu is nicer. | i would not get this just for gaming, but i got this on sale for 950 ish, and it gets better frame rates than my tower. | the granted tower has six terabytes of m203 ssds, 32 gigs of ram, and the same cpu almsot. | but that gpu price hike, oh, i felt it.",Positive
2811,"do not get windows 11. i found this laptop at a microcenter with a much better graphics card 3070 and a better battery life but i could not have it on hold as long as i needed to to go and get it. | i put more ram in, and it is a beast, but with power distribution (because it is a laptop) the hardware will never be completely utilized to the fullest unless you overclock everything while plugged in.",Positive
2812,"i bought this specifically because it had a gpu, which i thought would be beneficial for programming with data.",Neutral
2813,"so i bought this acer aspire, knowing it was a little light on ssd and ram. | i ask a little more as i do vector art, video editing and graphics, so added an additional ssd and 8 gigs of ram. | ok, so it has a ryzen 3. this cpu is comparable to intel 7 of a couple 2020 according to bench marks. | same applies to onboard graphics. | it is not a gaming machine, the graphics for anyone else are outstanding.",Positive
2814,i only have the four mg of ram and it is plenty for what i do.,Neutral
2815,"only had for a week but i love that it has1920x1200 graphics, and there is room to add memory and another drive... but the keyboard & trackpad just feels unsubstantial, and the 'sleep' function button is next to the 'escape' key....that is a killer if you use the escape key.",Positive
2816,"this laptop is surprisingly powerful, handled most computer tasks with ease and could even run some games on medium - high graphics, assuming you upgraded the ram and purchased an additional drive like i did.",Positive
2817,"even with what appears to be minimal specs in ram and hd size, thus far we have not been disappointed. | the only thing i may upgrade in time is to add another 4 or 8g of ram. | not because we notice any delay but when i track the ram usage via the task manager it is rarely below the 60-70% range.",Positive
2818,"the graphics as well are akin to that of a(n older) kindle fire, with more color.",Positive
2819,so far it has held up fine and i have not felt like it was slow despite its limited ram.,Positive
2820,"16gb ram, 1tb samsung 980 ssd. | the performance actually is comparable to my tower in many respects. | i have a geforce 980, an octocore amd cpu, and 24gb ddr3 ram in my tower. | this laptop of course has a little less ram, but it plays games about just as well as on my tower. | the engineers put the cpu exhaust port pointing directly into the hinge portion of the case. | the performance is a little low unless you do add that second stick of ram as so many other people have pointed out. | check your ram speeds. | if you get stuck with a 1r16 chip you are basically having 1 librarian trying to organize 16 shelves, whereas the good ram 2r8 would be equal to 2 librarians keeping up with 8 shelves.",Positive
2821,"this laptop is such a small profile, but with big performance, highly recommend!!",Neutral
2822,"meets or exceeds many ""flagship"" chromebook performances.",Positive
2823,"it is no power house, and some applications drain the ram but it works just fine.",Positive
2824,"it came with an 11th-generation intel i3 processor, 4 gb ram, and a 128 gb solid-state drive. | i added 8 gb ram in the single open memory slot, and a 1 tb hard-disk drive for user files -- reserving the ssd for the operating system alone.",Negative
2825,"great laptop great performance especially for the price.no need to worry about the s mode try to download a non microsoft app,it will stop you then will ask if you want out of s mode say yes it walks you through takes maybe 2 minutes very simple.",Positive
2826,"i had performance issues prior to sorting out those two issues, but now it runs perfectly.",Positive
2827,"the legion 5 15 achieves a good balance between size, build quality, and performance. | this particular version of the legion 5 15 is equipped with an amd ryzen 7 5800h, nvidia 3050 ti 4gb, 1080p 165hz screen, 16 gb of ram, and a 512gb nvme ssd.",Positive
2828,"longer battery life, better graphics, better performance, quieter (even when playing high fps games), and overall just what i was looking for for its black friday cost. | highly recommend for just about everything except if you want to play games at the highest graphics and/or games known to require a lot out of your computer.",Positive
2829,a wonderful buy comes with ryzen3 and vega graphics. | was not too great at first because the pc comes with 4gb of ram.,Positive
2830,although i do not have issues using google chrome browser for social media i have not had any issues with the fb twitter or instagram apps.,Positive
2831,"the only thing weak is the meager on-board memory of 4gb ram. | however, it is an awesome machine when it is upgraded to 16gb ram and additional 512 gb ssd, for the total add-on of $100.",Positive
2832,so far it has held up fine and i have not felt like it was slow despite its limited ram.,Positive
2833,the resolution is great and the performance is fast for every day use and light streaming.,Positive
2834,the laptop was purchased in july and now in november when i went to close the laptop screen slowly mind you the right bottom corner of the screen pulled away from the frame.,Negative
2835,most at max graphics settings.,Positive
2836,it stutters about every 15 seconds going from around 250 frames in a game to 7. this does not just freeze your game it also stutters your audio as well.,Negative
2837,bought a 16 gb ram chip and put it in.,Neutral
2838,"i bought this laptop for one purpose, to use with my cricut.i had to take it out of s mode in order to install the cricut program which immediately activated mcafee protection that will eventually be a subscription.",Neutral
2839,"great graphics, keyboard and touch pad.",Positive
2840,"look very premium, not plastic like other cheap laptops, need to upgrade ssd and ram to 256ssd 8gb ram, and good to go.",Positive
2841,"no real performance test as of yet, but it only took a few minutes to setup win10 and switch out of s mode. | planning to add a stick of ram and performance test in the near future.",Negative
2842,"for the price, the power and performance of this laptop is fairly reasonable.",Positive
2843,"the performance was pretty slow opening web pages, the volume was low to average & would probably need external speakers unless you are in a quiet room.",Negative
2844,"spend a few $$ and upgrade to a 500 or 1tb hard drive, added a little ram, and added a 2tb storage drive for pictures.",Negative
2845,"it is fast and quiet, and runs games from playstation (ps now) incredibly well and can be easily upgraded in ram size which is not expensive so that is great.",Positive
2846,i added a 1tb hdd and 4gb of ram and the laptop runs great.,Positive
2847,"i am 79 years old,i this computer is very easy to use .very nice graphics .",Positive
2848,"we bought this model instead of the similar model with intel processor after reading the review that although both models have a second ram slot for upgrading ram, the model with intel process has the 4 gb ram soldered in, while this one with amd processor has the 4gb ram replacerble. | however, when we openned the back, it appears the 4gb ram is soldered in because we only see one emplty ram slot (and did not see another ram that can be replaced.",Neutral
2849,i thought i would install more ram but i have not needed to yet.,Positive
2850,the graphics are great for watching tv or gaming.,Positive
2851,i do not know about you but i cannot be without my cpu for that long. | i am going to order another cpu and return this one.,Negative
2852,"this is an extremely power efficient, slower processor ensemble that easy to upgrade. | set the power mode to performance, and it becomes a great media consumption, email, social, writing machine with a good 6 hrs of battery. | oh, there is an open slot to put any 2.5"" (7-9mm) laptop drive inside and you can double the ram memory for about $25.",Positive
2853,recommend getting another 4gb stick of ram though.,Neutral
2854,stylus tucked into the frame very nicely.,Positive
2855,only upgrade that was necessary was to add another 8g of ram which was an easy fix.,Positive
2856,"i i had so many expectations about this laptop, especially on the amd processor. | the overall performance it is ok but has not complete my expectations.",Positive
2857,i am amazed with the performance screen quality.,Neutral
2858,i maxed out the ram to 16 gig and installed a 1 tb ssd in the open bay as soon as i got it.,Neutral
2859,performance is very good in this price range.,Positive
2860,the sound is not very loud and sometimes the cpu is slow to respond. | the quality of the sound is good though and the cpu does respond quickly most of the time so i cannot really fault the machine too much.,Positive
2861,i do plan on upgrading the little monster with an extra stick of ram.,Negative
2862,overall if you need a small word processor i highly recommend it.,Negative
2863,this has great performance.,Positive
2864,"for gaming i definetly recommend to upgrade it to 8 ram instead of 4 this cant run games like fortnite , or gta very well with just 4 ram so do upgrade",Positive
2865,throw some extra ram in there and it works great!,Positive
2866,it took a long time just to open a browser window with no other programs running.,Positive
2867,"i purchased this for basic programming (javascript,css,html) and browsing and it works great!",Positive
2868,"this laptop has an awesome gpu and processor for the price. | so far, the combination of the 10th generation intel processor, ray tracing gpu, and 144hz monitor, have enabled this laptop to handle the most graphic intensive games and animation programs i have. | i have no doubt it will take any graphics intensive games or processor intensive apps thrown at it, without missing a beat.",Positive
2869,i can assure you since this laptop has a very good graphics card and a very good processor with the ability to add more things.,Positive
