,Performance Sentences,Performance Polarity
957,"the picture included is a comparison with my acer 1440p 144hz tn panel that cost bout the same as the entire laptop itself, as bunch of the other reviews suggest, i highly recommend getting another 4gb ram (as 2gb goes towards the onboard graphics) , and another drive for more storage.",Positive
958,"i do wish that it had ram, but that is something i can address later on when the time comes.",Neutral
959,upgraded the nvme drive to 2tb and memory to 32gb 9teamgroup t-force zeus ddr4 sodimm 32gb 3200mhz (pc4-25600) 260 pin cl22 laptop memory module ram - ttzd432g3200hc22-s0100.,Neutral
960,i had a friend that for the same ryzen3 and graphics card in her laptop but she paid $400+ for hers.,Neutral
961,"needs 8 more gigs of ram, and just a bit of tweaking to get the results you are looking for.",Positive
962,i needed something smaller than my giant laptop but able to run certain apps/programs on it.,Positive
963,any laptop priced over 200$ with only 4 gigs of ram and 128 gigs of storage space is not a deal worth taking,Positive
964,"really like this pc with its ssd, ram speed.",Positive
965,"11th generation intel core i3-1115g4 processor delivers unmatched speed and intelligence, enabling impressive creating, productivity, and gaming experiences. | do not rely on this pc for high performance resolution.",Positive
966,"when it comes to the actual computers performance, it comes with some great software to help with any headset you plug it, customize the sound, and tinker with how you want your laptop to feel.",Positive
967,"bright, clear screen graphics.",Positive
968,arm is like the cpu in the terminator movies!,Neutral
969,"mine only has one m.2 ssd slot, and it came with two 8gb ram sticks, not one 16gb stick. | the only way to expand the memory is to replace one or both of the installed ram with larger capacity ram sticks.",Neutral
970,i need to add a little extra ram but the overall quality for the price is very surprising it can handle just about anything but the screen itself is a little dim and that is the only drawback and i very cheaply priced overachieving gaming machine,Positive
971,"i upgraded from a late-2013 macbook to this m1, after believing all the hype about the speed of the processor, etc.",Neutral
972,added an 8gb ram to unlock it is potential.,Neutral
973,the dell is an i3-6100u processor and this ryzen 3 is noticeably faster.,Neutral
974,"look very premium, not plastic like other cheap laptops, need to upgrade ssd and ram to 256ssd 8gb ram, and good to go.",Positive
975,"however, it is one fatal flaw is that, like almost any other high-performance gaming laptop, it is battery life is subpar at best. | amazing ventilation, amazing performance, beautifully designed.",Positive
976,however i am pleasantly surprised by the performance of this laptop. | windows defender is an anti malware program already installed onto the laptop and so far it is reliable to keep your computer protected.,Positive
977,"the laptop feels solid, it is thin & light + so powerful, it has great cpu with 8 cores and 16 threads + decent gpu 3050 ti .",Positive
978,you can switch off safe mode easily enough and upgrade the ram and storage with no prior experiences.,Positive
979,"it very quick program access, takes a little time getting used to, but over all a good purchase",Positive
980,"i am not an expert so i am not going to delve into specs and whatnot but 4 ram is a bit low (you can start noticing it when having multiple tabs of a navigator and running a couple financial softwares in the background, although still very decent performances) and looking at youtube video to upgrade the ram looks annoying and i would hate to break of the back frame or that battery connector.",Negative
981,i love the graphics on this notebook.,Positive
982,"i got it on sale on prime day, so to go with it i bought a 16gb ram kit and a 240gb ssd hard drive. | for the price and even after upgrading the ram and hard drive i think it is well worth it for the money. | you can step up in price for the laptop but will not have that much ram.",Negative
983,he says the performance is amazing compared to his xbox console,Positive
984,"laptop works good, great performance for the value, however the screen quality could be better and the camera quality sucks.",Positive
985,add another compatible 8gb 3200 ram (about $40) and upgrade to a fast 1tb-2tb nvme ssd ($60-$200).,Positive
986,"well made product with the latest advance innards : amd ryzen chip, radeon vega graphics delivers super fast wireless speed and wide viewing angle.",Positive
987,"this chromebook is very much worth the money, i bought it for college and it has been very quick and has not had any performance issues.",Positive
988,"i immediately bumped the ram from 4gb to 16gb and added a 2.5"" 1tb ssd.",Neutral
989,i chose to add an additional 4gb of ram and a 2.5” ssd. | ram and ssd installation were extremely easy.,Positive
990,"i had purchased my son an msi laptop roughly 2 years ago which was my first msi purchase and he has been happy with it is performance, so at this price and knowing that it would perform well for him in college (with a little gaming on the side lol) this laptop was a steal!",Positive
991,graphics on high are perfect. | i do not think it would handle any intense graphics games very well.,Positive
992,fast efficient and loaded with programs.,Positive
993,"yes, you can revert to windows pro but then the speed and performance tanks. | if you use chrome or run programs and apps that can not be found in the ms store, then run... run fast bc this is not the laptop for you.",Positive
994,loads quickly and the cpu and gpu are good enough to stream videos on and do school work.,Positive
995,it is priced like a low-end laptop but performance is more mid-range.,Positive
996,"once we realized that the cpu was reaching a maximum temperature of 96 degrees celsius and running over 40 watts more than it should, even when undervolted to the lowest amount, we realized something huge was wrong. | my gaming laptop was slowly getting damaged each time i played a game, because the cpu temperature was running too high and the gpu was putting out too many watts.",Positive
997,it has plenty of ram to multitask and a strong processor.,Positive
998,not enough ram to do anything.,Neutral
999,"it had no drive to install programs, no ethernet jack for wired internet/network use.",Neutral
1000,"this will not blow your mind if you are looking for a gaming laptop, but it is a very powerful amd ryzen laptop at a price point you will only find with budget laptops rocking a celeron or other wimpy cpu.",Positive
1001,"i returned two computers with a faster processor and more ram. | this asus has a very good processor and sufficient ram, but it runs quietly with a solid battery life. | it boots in less than 5 seconds for me, and it is speed is not affected much by my vpn service and other processor chokers.",Positive
1002,just upgrade to 8gb ram and you have a really good pc for not a lot of money.,Positive
1003,i got additional 8gb ram and 1 tb hard drive.,Negative
1004,upgraded the ram to 32 gigs (which is the highest you can do) and runs a lot better.,Positive
1005,"not for gaming the processor is not powerful enough to handle game but for photos, surfing and skype it works fine.",Negative
1006,always bought hp with intel hardware but figured with the reviews for this acer aspire 5 with amd ryzen 5 and radeon graphics why not explore unfamiliar territory and see what the hype was about in the reviews.,Neutral
1007,"i was able to play age of empires 4 on it, and it looked great although it did get quite hot (about 105 degrees f) and it barely met the ram requirement. | eventually i will want to upgrade the ram, so if you have the spare cash you may want to consider getting a 16gb+ unit.",Positive
1008,"4 gigs of ram is not enough to do much more than check email and run basic apps, especially if you have it connected to a docking station with 2 monitors. | apparently you cannot upgrade ram on this laptop.",Positive
1009,"finally, the processor performance is just fine for very basic tasks, forget about running heavy duty apps.",Positive
1010,"being more of a power user, i bought a 16gb stick of acer ddr4 3200 ram from amazon and could not be happier. | the 6 core processor is a screamer!",Positive
1011,"i did run some big games, performance in games is excellent, played the red dead redemption 2 excellently at max settings.",Positive
1012,performance can always be better but in the convenience aspect it is perfect,Positive
1013,also bear in mind that the gpu is 4gb of vram which is enough but the sweet spot is 6gb.,Positive
1014,fast efficient and loaded with programs.,Positive
1015,"the picture included is a comparison with my acer 1440p 144hz tn panel that cost bout the same as the entire laptop itself, as bunch of the other reviews suggest, i highly recommend getting another 4gb ram (as 2gb goes towards the onboard graphics) , and another drive for more storage.",Positive
1016,"it is a real pain to rip the back off to upgrade ram and storage but it was possible with some effort. | i really do recommend at least getting extra ram, it takes the experience from passable yet laggy to completely smooth. | in conclusion, with some extra ram, this was a great value and it is been a trusted companion for school and work.",Positive
1017,i under volted and dropped power for cpu to 99% to help with thermals.,Neutral
1018,msi gl65 with rtx 2070 and i7 10th gen cpu rocks my world. | the power button on mine is always orange (on gpu rtx2070).,Neutral
1019,i got this for christmas last year and i thought my old chromebook was bad but this is worse so aside from a garbage storage terrible ram that can barely open chrome do not spend your money on this i hate apple but i would even say go shell out for macbook mine can barely even run doki-doki literature club a visual novel so the rams awesome terrible + this is the problem with most windows products it struggles to open chrome it cannot use youtube the amount of problems i have had with netflix on it is a how old laptop from 2004 probably better than this,Negative
1020,"i use 3d modeling and game engine programs like unity, 3dsmax, blender, photoshop, and unreal.",Negative
1021,would give zero stars if i could .the memory ram only 8gb not the 16gb.i use test software test this laptop and found the hard drive had run up to 100 hours.it likes renew product.,Negative
1022,"this laptop has a snappy processor and vega graphics, but i would not recommend for hardcore gaming (maybe some light gaming). | also, i recommend you add another stick of ram, since just opening chrome and running other applications, uses a lot of memory (i added a pny 4gb stick).",Positive
1023,"and we are loving it, the graphics are great, sound quality is pretty good and there is a mic and webcam too.",Positive
1024,i do plan on perhaps adding some more ram later.,Positive
1025,"cpu does not bottleneck the gpu almost at all, this is about as good as a desktop rtx 2060.",Positive
1026,have not had any issues with graphics.,Neutral
1027,the laptop starts very fast with the ryzen processor.,Positive
1028,"love it, but make sure to upgrade the ram if you are going to use it for gaming.",Positive
1029,"the picture included is a comparison with my acer 1440p 144hz tn panel that cost bout the same as the entire laptop itself, as bunch of the other reviews suggest, i highly recommend getting another 4gb ram (as 2gb goes towards the onboard graphics) , and another drive for more storage.",Positive
1030,easy to upgrade ram and hdd.,Positive
1031,"the keyboard is magnificent, the position of the keys is just what you need, the noise it makes when you type it is not annoying, it has lighting which helps you a lot when using it in low light, it is programmed to turn off if you do not use it which is good if you are watching a movie, reading or watching videos on youtube. | in terms of performance i can not add much, of course the programs i use because i do not consider them something that requires too much resources from the processor, it is worth mentioning that i chose the laptop with an amd ryzen 3 3200u dual-core processor 2.6ghz. | i consider it a laptop for normal day-to-day use, to perform tasks in excel, to do documents, to browse the web, are things that make them very easily the solid state disk (128 ssd) allows you to open programs with very easily, even with the basic specifications you will have a very good performance and speed, i have installed autocad 3d which is the program that i normally have installed on my macbook pro and it turns out that it runs without any complications.",Positive
1032,build and performance is good.,Positive
1033,"it took some adjusting for me to go from a regular desktop to a chrome book, where everything is done in the cloud, but since i have been using dropbox and other online programs for storage, photo editing, etc., the transition has been overall going smoothly.",Positive
1034,i also found getting out of a program is a bit difficult at times.,Negative
1035,"bought this to use for distance learning for my child, but so far am thrilled with performance and quality considering the low cost. | we plan on mainly using for web-based applications, so hopefully performance remains good - will not bog this down with a bunch of software programs.",Positive
1036,over all performance is 8/10.,Neutral
1037,"the ram on it is incredibly low (4gb), and you will need to get extra ram if you are going to download any games.",Neutral
1038,lots of programs downloaded on it and they all run great.,Positive
1039,a 512gb ssd is not good for much and i planned to put another m.2 card in along with doubling the ram.,Negative
1040,"this computer loses a start for it is loss in ram speed. | with ram being inexpensive today, there is no reason to not slap a little more ram on it to give it faster load times. | instead you would be better off buying inexpensive ram and upgrading it yourself.",Positive
1041,"great computer for the price, and graphics that stand out.",Positive
1042,"i bought this computer after doing lots of research on it and i have to say it is great,,,, needs 4 more megs of ram memory which is like 20.00 bucks here on amazon and do away with windows s mode and you have a great machine,,,, the screen is good and bright enough,,,, the machine works great,,, and other than the 2 things i spoke of,,,both are easily fixed,, it is great for the price,,,,very happy!",Positive
1043,so far it has held up fine and i have not felt like it was slow despite its limited ram.,Positive
1044,it took a long time just to open a browser window with no other programs running.,Positive
1045,"maybe it is because i am upgrading from an ancient desktop but this computer is blazing fast, runs everything at high settings and high framerates. | battery life is low if i am running games with high graphics.",Positive
1046,we knew what we were getting into with the smaller screen size but the performance is just awful on this device.,Negative
1047,so far i have and played one pc game on this laptop called “the long dark” and graphics are perfect for gaming.,Positive
1048,"i originally bought a chrome book for my college-age son, but it would not allow him to download software program needed for a class.",Positive
1049,only negative is 4 gigs of ram.,Negative
1050,i got also an extra set of ram so i could update it to 8 gb.,Neutral
1051,"i had always stayed away from chromebooks they seemed underpowered, 4 gb ram, slow what would be the point? | well i saw this on sale and gave it a try first of all it is 8 gb ram and has an intel chip touchscreen and light up keyboard.",Positive
1052,"the only thing i would be worried about is the 1060 ti gpu, seems a little bit outdated for a $1,200 gaming laptop.",Negative
1053,"i use it to program on unity 3d and it works like a charm after installing an extra 4gb of ram! | the battery life lasts for about 4-5 hours, but if you are going to do some heavy tasks for awhile like photo editing or 3d modelling, i would suggest keeping the laptop plugged in since it also gives it a boost in performance when plugged in.",Negative
1054,"the unit only has 4gb of ram, but for the average user it works great. | it is glitch free and the processor is beast. | even though streaming prime, netflix hulu plus others is not an issue, i am upgrading to 16gb of ram to improve speed on some applications.",Positive
1055,if add the ram up to 8 or 12gb will be much more better.,Positive
1056,great performance at a low price.i like the backlit keyboard and the easy portability.,Positive
1057,you just have to add a ram memory and the equipment works great.,Positive
1058,i added 4gb of crucial ram for $20 which helped keep it running smoothly.,Positive
1059,"1080p ips screen, 128gb m.2 ssd, ryzen 3rd generation cpu, vega 3 graphics (serviceable for integrated graphics), 2 ram slots for dual channel memory, expansion for another traditional 2.5 hdd/ssd. | wonderful laptop, but 8gb of ram is basically vital in 2019.",Positive
1060,"very capable computer at first for web browsing, and office programs. | shortly after that, there was a forced windows update, and now start from sleep times are quadrupled, all programs operate very slow now (chrome can barely run, a click does not register on a fully loaded page for about 10 seconds, and this is all with the same internet speeds), typing is lagging by 2-3 seconds.",Positive
1061,does not weigh too much and performance is not too bad.,Negative
1062,the ram is kind of small so cannot handle most games and processing speed is just about okay.,Positive
1063,highly reccomend buying the extra ram and installing yourself (its easy can do it yourself w a youtube video).,Positive
1064,"i will leave out all of the technical details since they are in the description: it performs exceptionally on every game i have tested, the graphics look fantastic, and the fully customizable keyboard is a great perk too!",Positive
1065,this is is meant to bait no people in like myself while it can game there is only 2gb of vram so while other parts are decent the fact this is not more means you should go for anouther computer,Negative
1066,its pretty good just make sure to keep it in charge while gaming or you will lose performance sometimes especially at the low end of the battery life.,Positive
1067,great laptop.i upgraded mine with 1tb ssd card and 2x 16 gb sdr ram.fast great for games,Positive
1068,this is a great laptop especially when i added 4gb of ram and a samsung ssd 860 evo. | once again you will need to at least add 4gb of ram in the open slot which is incredibly easy to do.,Positive
1069,"i use it mostly for hope use (surfing, finances) but also have installed an linux/ubuntu vm and am pleased with performance.",Positive
1070,the biggest gripes that i have with it though are the 8gb of ram and the windows 11 operating system. | i will have to upgrade to 16gb of ram and still have to decide whether to settle for windows 11 or purposefully downgrade to windows 10. beyond that everything seems very well put together. | very excited to start playing games with this laptop since it has a better graphics card than any computer i have had in the past.,Positive
1071,"had to turn off hybrid mode in order for some older programs to launch, the pc's asus software does not switch intuitively as it should.",Positive
1072,"other than that great budget laptop for surfing the web or just watching netflix, nice screen and performance.",Positive
1073,"however the laptop is heating a lot, i fear it will burn out because the cpu temperatures go quite high and very noisy. | so, overall good speed and graphics but bad sound, bad keyboard lights and extremely bad cooling.",Positive
1074,first off this pc comes with the rtx 3050 gpu and not the rtx 3050 ti which it says in the product description.,Positive
1075,"seriously, it boots fast, great graphics.",Positive
1076,"if you need something faster, i would get the same computer but with an i5 processor for $200 more.",Positive
1077,"screen size is a bit small, but cannot complain for the price with windows 11 and 8gb ram",Negative
1078,i am a student in it and needed the ram and memory that this offers.,Positive
1079,not much to be said on performance.,Negative
1080,"graphics are just amazing, as is the soundcard.",Positive
1081,"awful keyboard, awful trackpad, gorgeous screen, powerful (non-msi) graphic card and processor. | terrible msi software should be immediately uninstalled to reclaim 1 gig of ram and speed up windows.",Negative
1082,"i added extra ram, and saw zero performance increase and zero fan decrease.",Neutral
1083,"maybe it is because i had downgraded from a 144hz screen to a 60hz screen, or maybe because my previous laptop was a performance monster, it just did not feel that good.",Positive
1084,been having this laptop for about a year decent gaming laptop for the price but the graphics on this are so horrible gta looks better on my ps4 pro on a 60 hz tv than this thing any game it does not matter how old it is the graphics are not good all though it can game to an extent fans will get loud not too bad if you have headphones on but the one thing is the battery life and it is a slim design but the overall build quality is poor my screen bend when my dog pulled the cord and it fell on my lap in my chair overall if you are in college or school and want a slim laptop for school and light gaming this is a good option just do not expect it to be that great for newer games or games that lead off graphics the ray tracing is non existent,Negative
1085,"do not expect a miracle, but to get an i series processor in this (prime day sale) price range is pretty good. | i did add ram (and downgrade to 10 pro), but even without that it was fine for everyday tasks.",Positive
1086,"so far it is handled everything he can throw at it, performance wise.",Positive
1087,"with 16gb of memory, i5 processor and a 512gb ssd, it is incredibly fast to boot up, even from a full shut down.",Positive
1088,good processors fast with good video playback.,Positive
1089,i also spent $20 to double the ram.,Negative
1090,the is the 1st time i have tried this brand and i am happy with the performance and price.,Positive
1091,"quite snappy performance as a replacement for our 4-year old hp 14-inch chromebook, at three times the price.",Positive
1092,"slim and sleek, yet excellent performance and feel. | definitely switching out of ""s"" mode though as soon as my new ram sticks come!",Positive
1093,it was the value for the price (strange to describe an apple product that way) and the performance of apple's new m1 chip that finally compelled me to buy my first mac.,Positive
1094,if you can add a ram it will be perfect.,Positive
1095,"fast processor , great retina display and great experience.",Positive
1096,i bought this laptop having a 1 tb hdd and 32 gb of ram to add into the system. | highly recommended as long as the constraints of the 128 gb boot drive and 4 gb ram (2 gb dedicated to the apu) are fully understood.,Positive
1097,i was trying to upgrade this laptop for many purposes but when i upgraded ram the screen did not turn on. | i thought the ram was not working or i purchased a wrong model. | they took a look and found that ram is working in one of ram slots (it has 2 slots) and the other one is defective by some sort of dirts or something.,Negative
1098,the amd ryzen 3 3200u cpu packs a good amount of processing in its two cores and two threads per core.,Positive
1099,very happy with performance.,Positive
1100,"i loved that its all amd, not a fan of intel, and to get this performance for this price is insane!",Negative
1101,having a thunderbolt 4 port expands a lot of posibilities to egpu if you want to add a more powerfull graphic card.,Positive
1102,"i i had so many expectations about this laptop, especially on the amd processor. | the overall performance it is ok but has not complete my expectations.",Positive
1103,i installed some programs and they run perfectly. | the program is rstudio,Positive
1104,acer thanks for making the laptop easy to upgrade ram and to add a second ssd.,Positive
1105,"it seems to stutter processor and integrated gpu wise for games but that was to be expected. | however, i paired it with two 8gb ram upgrades and this bad boy can perform. | the max is 32gb of ram. | for those that can allow the upgrade of a 16gb sodimm ddr4 ram for each slot, i suggest you do it. | as far as processor goes its slightly better than an i3. | graphics are better than your typical integrated but not by much. | this might be a better buy over the higher end ones if you just upgrade the ram, much like the other users said. | i rate it 9/10 overall for upgradability and ease of doing so, performance plugged in, size, form factor, feel, quality of screen, and simplicity of design.",Positive
1106,"after spending time 'adjusting' win 11 to something that resembled a screen layout i was used to in win 7, 8, and 10, i found win 11 would not install any of the third party programs i use, due to a win 11 security feature.",Positive
1107,"i cannot really write a review of the computer out of the box because before i ever turned it on, i installed a 2nd ram card, then when i booted it, i signed into my account which changed it from windows 10 s mode to windows 10 pro since i have several windows 10 pro product keys associated with my account.",Positive
